SL. ,Comment,Hate,Type
1173,ekhane tomra kon type er???,No,Not Hate
1174,egulare dekle guitar marte mon chai,Yes,Sexual
1175,amar pochondher to Fariha Muinat ogo fariha jaio nah amy chariya,No,Not Hate
1176,Chotobestur cruss ta k amr bou hisabe diye den,No,Not Hate
1177,kalato Vaii tumi koiii ,No,Not Hate
1178,Amar lage tomar khalato bon,No,Not Hate
1179,yellow color dress pora meyta name ke ,No,Not Hate
1180,Koto boro hoea gese dudh  tah,Yes,Sexual
1181,Haha dite giye Amar khali wow hoye jasse ,No,Not Hate
1182,Amare khalato tare dilei hobe khawar jonne,Yes,Sexual
1183,"Dada go tomar ex kto dheklan kintu tomar gf kothai go ,ar tomar ex k amar khob valo lge6a go amak daw ",No,Not Hate
1184,Madarchod video ta dekhte de,Yes,Slang
1185,Digi onk boro boro,Yes,Sexual
1186,Vai eirkm vdo beshi beshi diyen plz vai plzz ,No,Not Hate
1187,Matar tar chire gece naki?tar chire gele pabnay jao...,Yes,Others
1188,Alifa or Miya kholifa,Yes,Sexual
1189,Jaiga to mone hoi chena chena lagtese??? Video er sheshe giye dekh ,No,Not Hate
1190,fake fake . meye tar kotha shuney bojha hacce vai. bal chal banano bondho koren,Yes,Slang
1191,Vai amar nam alifa....  K je amon post korce... Ar family  member vedio iva dakhile ar 12 ta bajai dibu,No,Not Hate
1192,mayeder voice e ctg language tmr thekeo beshi cute lage,No,Not Hate
1193,TUR boner Mayra chudi,Yes,Slang
1194,vulgering koira ki market fawa jae????,No,Not Hate
1195,Dari gula tor mhuke manay na ,Yes,Appearance
1196,Picone may b soibal das shumon dada gecilo,No,Not Hate
1197,Tokhn amio arpita dimu deikkho,No,Not Hate
1198,Vaia apni gonybekary te vdo krsen apnr basha ktay,No,Not Hate
1199,Ore baincod,Yes,Slang
1200,tomar shona diye churi golay dimu,Yes,Sexual
1201,Akto o balo lage nai ho,No,Not Hate
1202,Tomader kii khaiya kono kaj naii faltu jotosop,No,Not Hate
1203,Vai apnar muke 12 mas pan take??,No,Not Hate
1204,Sob koytake dore chude dile valo hoto ,Yes,Sexual
1205,Aj biri khai na bole bow pelam na..,No,Not Hate
1206,Taile ami ajke theke lal biribkhaoya suru korlam,No,Not Hate
1207,  Marlboro gold khai... Hisebe jeita hoy oitah hoilei cholbo....,No,Not Hate
1208,Na jani amr ta kmn hobe,No,Not Hate
1209,Ami to kono biri sigaret e khaina tahle ki bou nai kpal,No,Not Hate
1210,Aj biri khai na bole...Bow nite parlam na...,No,Not Hate
1211,Maya biri nai.tahole ki Amar ta nai.,No,Not Hate
1212,Ey sob khankira ki moroner hoy korena khanki gula heta meta bair koira tik tok cuday paroa na,Yes,Slang
1213,Tik toker maire cudi,Yes,Slang
1214,onek sex er jalai emon hou,Yes,Sexual
1215,eder ghorar lingo lagbe,Yes,Sexual
1216,ajiara coda cora sob jaigai mor name dis na ,Yes,Slang
1217,dst ai khan teke ami konta nibo ekto deke bol nah ,No,Not Hate
1218,apni to miya ganjakhor,Yes,Slang
1219,tor konta lagbo ,No,Not Hate
1220,dst ai khan teke ami konta nibo ekto deke bol nah,No,Not Hate
1221,Guru ghula dekte sei khasa,Yes,Sexual
1222,vai ami to biri khai na amr bow kamon hoba janta caoa amar oboj mon,No,Not Hate
1223,Oii ita amrar deshi product nee be,No,Not Hate
1224,Dudh ashbe na jeneo chushe jai,Yes,Sexual
1225,"O vai akiz birir ta onk valo,,,ota cai",No,Not Hate
1226,Ahahaha sala briri khor re,No,Not Hate
1227,vai re mension dew,No,Not Hate
1228,vai sob gola ak ar.. akta dile a hobe..,No,Not Hate
1229,"Ami biri khaina ,,,,,mone hoy ebar khawa dhorte hobe",No,Not Hate
1230,Jar ta press korte moja beshi sheyta amr,Yes,Sexual
1231,khanki re lagbe,Yes,Sexual
1232,Aj biri khai nah bola ,No,Not Hate
1233,Last er mal ta...komor r boobs,Yes,Sexual
1234,dile to nunuta khara kore,Yes,Sexual
1235,Mandar po sutmaranir magi,Yes,Slang
1236,Amar to vai sob Gulai tomi ader k Amar vasay diya jaow,No,Not Hate
1237,biri khorer bou gula to khub sondor ahhh,No,Not Hate
1238,Koto mage dekbo ar..,Yes,Sexual
1239,johny ke deke jaiga noton bhore dibo chutmarani ra,Yes,Sexual
1240,khankir bacchader ki diya chuida ber korse?,Yes,Sexual
1241,Indian panno boycott korle na khaya more jaben miya,No,Not Hate
1242,ghu to apnara  khan,Yes,Others
1243,"ghu khaoa party, sorom kor,",Yes,Others
1244,India boycott korle ghu khete hobe likhe rakhen miya,Yes,Racial
1245,"na bhai , amader kichu e hobe na !!! Borong India aro 14 tukro hoye jabe !!! tokhon amra tripura ebong asham ke bolbo ",Yes,Racial
1246,"Lojja laga darkar, india boycott korle na khaya more jaben miya, Corona vaccine to India dilo, vule Galen nki",Yes,Others
1247,khobisher ghorer khobish.... Tor coronar vacsin amra use korina,Yes,Others
1248,Thanks for u vaiya .....Ara bidhormi Eman komanor jonno ader cokranto allah rokha koren insaallah,Yes,Religious
1249,Ata sajano ghotona. Ami jani. And amar hinduder poti bissas royece. Ata kokhono tara korte pare na....,No,Not Hate
1250,Taile tumi miya Surar print ta matite falay rakhchoke,No,Not Hate
1251,Tumi na muslim? Surar print ta matite Keno? Oita to kuran er ongsho e.. nije miya thik thako!,No,Not Hate
1252,Ar indian shalago jinish giya ogo mathay vango,Yes,Racial
1253,"Sob nizera baniya, hinduder aapoman Korar chakranta korchen, baje kaj",No,Not Hate
1254,"Puro mithya sajano sob, kau matha kharap korben na,",No,Not Hate
1255,"Mukhe mukhe shekh farid,  bogol main eet?",Yes,Others
1256,Jedokan theke kine chen mamla korun vai,No,Not Hate
1257,Avabe. Keo baje comment  korben na..  Jobi. Tomra sobai sristikortake valo baso. Tahole ar keo baje comment korbe na.  Ar jodio kore.. Tar jibone jeno. Sobsomoy dukkh neme ase ami sristikortake atai bolbo.,No,Not Hate
1258,Madar chod hindu jati,Yes,Religious
1259,Ar Ami jani Indiar ponn amdani na korle Bangladesh  na kheye morbe.,Yes,Racial
1260,Boykot India ponno,Yes,Racial
1261,Islam dormoka naraj Korar jonno.,No,Not Hate
1262,Januarka juta peta kora hok,Yes,Others
1263,Kuttar baccha malaun,Yes,Religious
1264,EAESOB JANUWAR HINDU MALAUN BEDIN SHEIK HASINA HARAMKUR DERKE DONGSOKORUN KOTOMKORUN,Yes,Religious
1265,ekattor holo hasina pala gavi,Yes,Others
1266,era shob bharot er dalal nastik iskon er dol,Yes,Religious
1267,ek number potita ,Yes,Sexual
1268,Sobair cehara AK rokom luge mone hoy sobai AK mayer Peter khalato bhon,Yes,Appearance
1269,Apne tik dorchen maa akta r bap kintu onekta maa o janena kuntar bap ke ba kithay ase ,Yes,Sexual
1270,Oder daikha mone hoitace india theke ashece,Yes,Racial
1271,Shob Jahannami ek shutai gatha,No,Not Hate
1272,Tumader kar koto rate,Yes,Sexual
1273,Nastik er sathe nastik e thakbe,Yes,Religious
1274,o sudu bessha khanki magi,Yes,Sexual
1275,juta diye pitabo,Yes,Others
1276,halar dui gal e juta mar,Yes,Others
1277,Vhi re . Ak soytaner sathe  aro 4 soytaner dekha..  tai na..,Yes,Others
1278,egula shangbadik naki khanki,Yes,Racial
1279,Asirbadh pusto bolei sokol mitha bolte kono didha nei ?,Yes,Religious
1280,Shob gula potita league,Yes,Sexual
1281,nastic der dol allaho eder dekhe na keno? eder Corona hoyna keno? allahor jomine theke allahor sathe dusmoni?,Yes,Religious
1282,Tader k ram da diye kopano dorkar,Yes,Others
1283,Kano Vai jay Sri ram koi gelo,Yes,Religious
1284,Bhai India te apnar msulim bhai bonerao thake tader jonno dua korun..,No,Not Hate
1285,tahole apni ekhoni mara jan. Jahanname jaben,Yes,Others
1286,"tomar moto ami potitaloy ar mati diya murti banaya puja kori na, ami na dekhe ALLAH ke bissas kori",Yes,Religious
1287,tahole vai mokka bandha korece kano??? ,Yes,Religious
1288,Maloyaner bacchagulir shikkha hoy nae ekhono! Allahr gozob prts egulir upor aro bsi porbe!,Yes,Religious
1289,"Eigula shob haramjadader fashite jhulaya mara uchit, kukurer bachara",Yes,Slang
1290,Janowar gulor ekhono shikkha hoy na.,Yes,Others
1291,Ata Thik na moszid a probes  ar somoi badha daini kano????  Chirari R ke,Yes,Religious
1292,"Police salader k dhore pitalona keno ,yogi puja korce tokhon kichu hoini",Yes,Religious
1293,ei janoar derjonno aj deshe gajub name corona virus,Yes,Religious
1294,Era o toh ekdin morbe..Allah eder hedayat dan korun,No,Not Hate
1295,Kafir okol etar jibone o sikka oito nay,Yes,Religious
1296,Allah toder kauke charbe na toder bichar korbei korbe,No,Not Hate
1297,Bjp er dalal o aachhe ...saathe,Yes,Racial
1298,Aei khankir pola police ray   kutta pida dawea ucit,Yes,Racial
1299,madar chud a ra akhno thik hoi nai muslim dr mare ,Yes,Slang
1300,kutrar bacchara toraw morbi opekkha sudhu somoyar,Yes,Others
1301,Nejer desh a mosjid bondho rekha6es kano...police hidndu muslim sob k pita6y....ja lawan6y na... Akhanu ghory bosy namaj porty bola hoicy.... Tau jodi jai...To korby... Bish 60rty Bangladesh r facebook page ostad.... Tahola toder desh r muslim police ra muslim lok der kano marsy,Yes,Religious
1302,Khup kharap kaj ata,No,Not Hate
1303,eto gula mosulli 4/5 ta lok ke kichu korte parlo na,Yes,Religious
1304,Aita thik korla na tmadr aro onk bipoder sommhuk khin hota hobe.?,No,Not Hate
1305,Allah hoi oder hadahat dan kor aer tana hola dogso kora daw,Yes,Religious
1306,Oi madarchodera toderkei corona dorvo..mone rakhis,Yes,Others
1307,Mandir e gia dekhun ek case hobe ......,No,Not Hate
1308,toder karonei aisob Gojob gulo asce..,Yes,Religious
1309,"Naussbllah Ha ""Allah"" tumi duroto odar bisar koro.......",Yes,Religious
1310,Kharap kisu kore ni,No,Not Hate
1311,Hindur bassa sob,Yes,Religious
1312,Tuder opor gojob hobe na kar opore hobe,Yes,Religious
1313,Ho bhai ay jonno too amon koira parbo tai nah ? India kopal onk khrp ashe likha rakho sommoi aste ,Yes,Racial
1314,adr modda vlo somporko?,No,Not Hate
1315,oh taila Muslim dr Muslim ra marse tai too hoita para,No,Not Hate
1316,SUNEN JANUWAR HINDU MALAUN VAROTER JANUWAR ERA KI BOLSE,Yes,Religious
1317,Jader coke kharap ta  to age oi hoyce akn vlo hoye ki krbo.kont ami bojlam na akjon bedolok oi khane ki kre,No,Not Hate
1318,"nastami kore agate hoyna re pagli,pasher meyetar to ...",Yes,Sexual
1319,or hedaet kokhono hobena.apni aktu govir vabe chinta korlei bujhte parben.mon diye noy dimag diye vabun.,Yes,Religious
1320,"Duniyate ato sundor,sundor dress thakte lungi kacha diye birthday celebrate korte hobe keno re boin",Yes,Appearance
1321,Ajke butol keya sorir kerap mna hoi akhon ki kowayte hbe jigass koro.,No,Not Hate
1322,Shirai shirai roktoh ami pori monir vokto,No,Not Hate
1323,"Tui o jemon Tor kacher manush to tamon,Tor ruchi onek kharap,Tor r jama kapor cilo na",Yes,Appearance
1324,Nana tupi pora r natin half pant pora ki Obostha,Yes,Appearance
1325,amaro Aslam rat ATO gobir hole hobe amadir kaj Suro hobe pori sate asul kaj ar akon ja hoyte chi sub nokol,Yes,Sexual
1326,Amio kacer manus hote chai,No,Not Hate
1327,ki ajob desh re bhai,No,Not Hate
1328,Or Moto nirlojjo behaia naika Bangladesh a r aktao naii,Yes,Others
1329,Kind hearted..se goribder ank valobase..manyser karap valo takbei....r amra sudu Karapta nia pore taki,No,Not Hate
1330,"Nana akta mother bord""""heteyr choker moddey kotta procrb korcey may be",Yes,Others
1331,Vaire vai akta maiyar piche j atto gula inlish thake baper jonmeo dekhini..nostamiro to. Akta shesh thake..Shoitan vabtace ami to amar jaigai aci but oi soitan ta k j amakeo shapia gece...,Yes,Others
1332,sob pagoler dol....sob sangbadik gula porimonir badde gache...akjon alem ar jnno koita sangbadik koc korche...,Yes,Racial
1333,Manoshik rugi,Yes,Others
1334,Bangladesh theke ber kore deoyal dorkar khankider poribesh nosto kortece ora,Yes,Others
1335,Bedi ta re maira ai labi boin..gola ta char ekto. Tor b day dkha. Amr b day name ai amii vule gsi...,No,Not Hate
1336,Piche to dekho shob che boro behaiya oi picher ta Lal top ali ,Yes,Appearance
1337,buski magi,Yes,Sexual
1338,Manush er paribarik sikkha ta khub besi important or moddhe tar cita fotau ney,Yes,Others
1339,Pori agea jao Tumi best of luck,No,Not Hate
1340,"C c c....pori akon posak porasa...mona hocsa luggi pora lagti korasa.,",Yes,Appearance
1341,Jebon  Tu motamote  are beshedin  nai apnar. Teamfar  Shashi.  Are koyek din pore.( Pore moni ) Tomar  obosta kmn Hoi  neja dekben,No,Not Hate
1342,Nanajan niz choke aigulo dheke khub Khushi hosse.Uni toh Abar mastor Chilen.,Yes,Others
1343,Takani customer khujse asob kore,Yes,Others
1344,koto kosto kore jel theke beriye elo Abar se Asole sobab tai ki eyrokom?,Yes,Others
1345,Magi dekih desh tare urof àmerica banai feltase .. oi mohila k desh theke Tara Tari bitarito kora hok. Na hole or dekah dekih jobusomaj odupotone Jabe.. sorkarer dristy akorson korchi,Yes,Others
1346,ja vabe r earm shai vabe e khoroj hoi,No,Not Hate
1347,Ara Manus namar kolonk o,Yes,Others
1348,monta chashche dhore akdom ischa motho thaprai,Yes,Others
1349,Somoar dam jader nae tarae agula dakha,No,Not Hate
1350,daraitei partesena thik moto atto nesa korse ,Yes,Others
1351,Ai pola gulore ki vara kore ana hoice,No,Not Hate
1352,Amar pokho thaka Or lungta dhora  kaw tan daw to ,Yes,Sexual
1353,Or jommodin a jara gachelo orau pagol  abong gidor chara ar kichui bolajabe na. Nosta akta meye,Yes,Sexual
1354,Porir paser mey tar dud gula ektu besiy choto mone hoccee,Yes,Sexual
1355,"Purai mental, ei nirlojjo mohila tar birthday kara sponsor kore..???? Bikargrostho…. Just obnoxious…!!!",Yes,Others
1356,Pinik aktu besi hoya gacha… sona kata porir….,Yes,Others
1357,Khankir Power Baira Gese...,Yes,Others
1358,Sorkar.aigola.valomonokora.taikortparasokart.nastiek,Yes,Religious
1359,"Kanki koi botle mal kaisos ,hsinar meye ,tore je kankir bassara caraice eder ma bon o jeno emon e hoi",Yes,Sexual
1360,"Nije to nosto meye, jatikew nosto krte chay",Yes,Others
1361,Ki obosta Bangladesh k nosto kore dichhe ,No,Not Hate
1362,Soytaner Nani,Yes,Others
1363,Ato kichur poreo biadop tar shikha  holona,Yes,Others
1364,Pasher ta ki uganda theke asche??eke sefu dar kache parcel kora hok ,Yes,Appearance
1365,Nana ta nirloj abar tupi pore boses,Yes,Appearance
1366,Bodhooooo pagol hoile jha hoi r ki ,Yes,Others
1367,Beshi niye felecho! Camera r shamne ashar ki dorkar chilo,No,Not Hate
1368,market pabena bubu ei natok kore,Yes,Others
1369,Soytan akon soytani care adar soytani dakhe,Yes,Others
1370,Eike ei des theke ber kore deye ochit ,Yes,Others
1371,jei puros akane ace salara sob locca,Yes,Others
1372,Toderki voy nai moroner. Toder ontor mohor mere rehkesen.,No,Not Hate
1373,Porimoni to pagol hoi geche..........,Yes,Others
1374,"oi to aka soytan noy soytan,,, or sather gulao,,, ata ki re vai mone hoy ami pagoler,,, mela",Yes,Others
1375,Banglades koto tuku odopoton hoise ai tar proman,No,Not Hate
1376,Age half mad cilo ekn full mad Hoye gace,Yes,Others
1377,Birthday te lunggi porte hoy ? Seta na jana ami !!,Yes,Appearance
1378,Kasa diye lungi porte mon cailo,No,Not Hate
1379,Mot khabi kha tai boila  ato ,Yes,Others
1380,oi maye tar dud ber hoye gelo re,Yes,Sexual
1381,Pura pinik a ace chutiya ceriday ,Yes,Slang
1382,Paser dudu to ber hoye jesse,Yes,Sexual
1383,Bandor posroy dile amontai hoy,Yes,Others
1384,maiya manuse eto mod kay ta porimoni caci ke deke bujlam ,Yes,Others
1385,Khankra video propose Puri Man Ki photopea Bangla,Yes,Others
1386,Or dress up ar moto or manosikota hoye gase,Yes,Appearance
1387,Asolai Pori ki korbo.Or Sex onak bashe..Tai or sojjo korar moto khomota nai?,Yes,Sexual
1388,ci meye .ei to meye na...ci eta k meye bolte ghrrina kore,Yes,Others
1389,Kasi pora diye dag dile thik hoye jabe.,No,Not Hate
1390,Sobar cheye baje naika porimoni,Yes,Others
1391,Jel theke ase ki pagol hoe gelo dukhe koste lojjae,Yes,Others
1392,Baje meye osubbo akta,Yes,Others
1393,toder Jonno porimonir je lunggi ta porches seta kinmu,No,Not Hate
1394,Mal khay ar soril naray,Yes,Others
1395,Nesha Kore Amon korlo pori ...,Yes,Others
1396,Dod gloa bidaler mto lage,Yes,Sexual
1397,Amader desh a pagol chodar mela bosce,Yes,Slang
1398,Traveller bus ki Purnima Gita Diya Rasta Rasta rikshawala pori Moni bus ki Maggi,Yes,Sexual
1399,Falto akta meye..,Yes,Others
1400,noton tk poisha dekseto,Yes,Others
1401,Aj kal shanbadik ra rastar kottar moto hoye gece.. Eishob magir kace giye news ken kore ami janina tader ki er kon kaj kam nai naki...eishob news o na news er bal o na...,Yes,Racial
1402,Tomar bodar ret to potitar ceye kom kanki,Yes,Sexual
1403,Apni to matal hoye achen madam,Yes,Others
1404,Harmjadi manus hoybo na,Yes,Others
1405,lal vodar pise,Yes,Sexual
1406,R kono posak paili na,Yes,Appearance
1407,Banglar mage,Yes,Sexual
1408,Ami ja Dekhi tumra ki ta e Dekho ,No,Not Hate
1409,Jony Sins ree dorkar,Yes,Sexual
1410,Magae code,Yes,Sexual
1411,hot meye,Yes,Sexual
1412,Doylotdiar noti,Yes,Sexual
1413,Se somaj ta dongso kore pelbe,Yes,Others
1414,khankir sathe khankimagir. polara,Yes,Others
1415,nosto reporter,Yes,Racial
1416,Ara hocce lawarisg beissha lojja sorom  bolte agulor kiso nai ,Yes,Sexual
1417,Modoner bacca,Yes,Slang
1418,Mane ata kon dhoroner style Salar Behaya,Yes,Appearance
1419,Mod  khaise soytan,Yes,Others
1420,Are mane tume bolta casso. Ja tume khub valo. Na motoyea valo meya na.ok,Yes,Others
1421,tora desh take lotir rajje porenote kirsis,Yes,Others
1422,Ekta boioshko mohilar shathe keu emn achoron kore,No,Not Hate
1423,Ajke aikan ar onk ai tired takbe cz onk gulur upr cake diye hat vuleye dice apu,Yes,Others
1424,Sangbadik ta bina dawate gese halago lojja nai,Yes,Racial
1425,Apni o to kacer manus ekjon apnake dekhailo na kn...!!,No,Not Hate
1426,Cc.c.c.c  arokom kkhono dekheni.,No,Not Hate
1427,Dudh gula ber kore rakhchis ken?,Yes,Sexual
1428,Mental akta meye ,Yes,Others
1429,Khankir pulara abar Allah r namnes,Yes,Slang
1430,Baba ato taka koi paye.......,No,Not Hate
1431,Bura salay oi jaygay ki kore ,Yes,Others
1432,Pashar cale goli er mal bar hocce,Yes,Sexual
1433,Sefoda koi ata ki akno dekheni,No,Not Hate
1434,Botkalab Jao porimoni kanki,Yes,Sexual
1435,Lojja sorom akdom ney ai mayyer,Yes,Others
1436,Tomi vul korso porimoni.....,No,Not Hate
1437,Tv gula kono news pai na abal,Yes,Racial
1438,Murkho choda tui sali,Yes,Slang
1439,Hayre behaiya pona,Yes,Others
1440,"Nortuki sara valora ki amon korte pare,,cici",Yes,Others
1441,Ai nodire dekhle bomi ashe,Yes,Appearance
1442,Deho bebsha,Yes,Sexual
1443,Tomy kokon gab detea hobea seyta o ganea....,Yes,Sexual
1444,mama tor kaser lok dance dicce dekh,No,Not Hate
1445,Lotir je kaj setai korce se banga gali,Yes,Others
1446,Bedop mohila kuno lojja nei,Yes,Others
1447,mama apnar name bollo na to,No,Not Hate
1448,Baje video bondo korun,No,Not Hate
1449,dekh ekhane oi meye ta ase,No,Not Hate
1450,tui Muslim er nam e kolonko,Yes,Religious
1451,Tor rimand newa kom hoice aro dulai ar dorkar cilo .  K jani police kaw  nice tola vara dicili ki n a,Yes,Others
1452,Porimonir pisoner Malta khub darun,Yes,Sexual
1453,"Ei kon osobho,meye.",Yes,Others
1454,Khankey magey,Yes,Slang
1455,"khanki dekhechi,,,kintu ei rokom khanki jibone dekhini",Yes,Slang
1456,magir hedar moddhe j ki jala,Yes,Sexual
1457,tui love react des keno?,No,Not Hate
1458,magire hatir lolmba dhon diye choda dorkar,Yes,Sexual
1459,Juta   marlam    togo   mukhy,Yes,Others
1460,tomake kutta chode,Yes,Sexual
1461,O holo ke janen...kau janen na...ami.....jani....f d  c r  kolonkoni,Yes,Sexual
1462,mage ekta janowar,Yes,Others
1463,comment gula nach tar thekeo beshi ajob. ,No,Not Hate
1464,manush kotota lifeless hoy...amar jonmodine ami nengta hoye rastay ashbo bhai kar ki,Yes,Sexual
1465,Okeo taslima nasrin er moto ber kore dibe desh theke,Yes,Others
1466,Osovvo akta.nirlojjo r faltu akta seri,Yes,Others
1467,"nana par kore niyee jabe,Allah knows better",No,Not Hate
1468,r jkn varot er bessha naiya der dkho  ora kub  vlo..j ja kore korte dau.nije vlo thko. Ok,Yes,Racial
1469,Hetir goyai moris dte hobee haa,Yes,Sexual
1470,Tui varot e ja ga othoba tor bon k dea avabe dance kora. Amra dekhbone.,Yes,Others
1471,"Kothay sabana bobita r koborir Moto guni shilpyra r kothay o,industry esob kivabe mene  nicce, bideshi canel bndo krce ki asob dekhar jonno,egulote ki Bangla shagickritir kono cinho ace,egulo o bideshi canel er theke Kom na",Yes,Others
1472,akhn chinlen Apu .......... Jale Ak bar cecha khaice ...Aber j Kobe jabe oi hotels girls ta ,Yes,Others
1473,Akbar nak katle jonggole r satbar nak katle ghorer duare.Or satbar nak kata hoya gase.Or dui chokha r kono lojja nai.Muslim dasha aei meya ke nisiddho kora hok.Amader vabte obak lage akta meya ki vabe pare arokom korte sobar samne.,Yes,Others
1474,tik bolesen.nirlojjo osobbo kare bole ai biadob ta re dekle boja jay.er ki kono lojja sorom ne.,Yes,Others
1475,Ai rokom bou er dorkar nai.,No,Not Hate
1476,"ekdom thik bolesen, sob socheton nagorik der er protibad janano uchit.",No,Not Hate
1477,Pori monir oporadh sha kano jail theke ber hoyeo birthday palon kortese and kapor khule dance korche. R edeshe motolobbaj loke ra duniyar akam kore jacche Tate kono oporadh nai!! Sob oporadh sudhu porimonir,No,Not Hate
1478,pori monir oporadh ta ki?,No,Not Hate
1479,jonmodin e ki korbe eta tumi bole diba?,No,Not Hate
1480,"jell a giye 10000 betar chuda kheye ber hoise,  or jonno aisob kicchu na.",Yes,Sexual
1481,sodo eaba na sobgola e akto basi nisa,Yes,Others
1482,"desh thakey taraben keno ata ki tar desh noi, Islami sharia holey shob shuja hoey jabe.",No,Not Hate
1483,Behaiya akta...lojja to naiyee..eidare bd theke ber kore dei na kn,Yes,Others
1484,Abr mod khaise re ,Yes,Others
1485,Remand e mair khaiya mone hoi pagol hoye gece. ,Yes,Others
1486,Ami bujhina ato gula manush er moddhe karo aktu mathay aslona j ore aktu pabna nite hobe ???? Or sathe ki sobai pagol hoye geche??,Yes,Others
1487,ami toh vabci diaper porcy ,Yes,Appearance
1488,api tiki bolco or sate shobai pagol hoye gece,Yes,Others
1489,Khaccor mohila akta eigulao manus dekhe manyser rucibodh kharap dekhei or moto mohila akhono tike ace,Yes,Others
1490,moja lage meaer. O meaer hingsa dekhe...hahahaha,No,Not Hate
1491,Urchhikhol R beyadob tiper meye ,Yes,Others
1492,Ata abar ki rokom nach.....amar friend ra ar teke besi balo nachte pare..Mone hoi uni manosik babe osustw hoye gese......ake to jwtw drutw sombob mental hospital a patano uchit....,Yes,Others
1493,Dim therapy kheye ooo vut chotlo naaa aro update version hoice onek cute lagse khala,Yes,Others
1494, amr y lojja lage r tor?,Yes,Others
1495,A maiya da gece pura e pagol hoiya,Yes,Others
1496,hogay eto current magir,Yes,Sexual
1497,eshob koira ki moja pay,No,Not Hate
1498,Loti marka kisu kisu maye ar jonno sub maye opoman hoy,Yes,Others
1499,Lungi khola thakle bhalo hoto,Yes,Sexual
1500,Magiire lunge te lagtasa kemon,Yes,Appearance
1501,"Onk khela dekhaico r valooo Lage na Rong dhong, shami thakte bidubar bes vlo baro vatari",Yes,Sexual
1502,First to mia malkova vabselam,Yes,Sexual
1503,Dor sotmarani...,Yes,Slang
1504,Khub sundr bt amr gf er moto ato cute na,No,Not Hate
1505,"Ato osovon kapor kemne pore manush nijer meyetar kotha aktuo ki vhabsen r amaro baccha ase apni ja korben bacchara tai sikbe r modern howa kapor kholake bolena puro kapor poreo modern hoa jai 
",Yes,Appearance
1506,Mithila tmi manusher kache ki chila ar ki hoye gecho! Tomar ki ruchite badhe na? Chi! Vabtei kharap lage ak somoy tomar vokto chilam,Yes,Others
1507,Akta meye koto ta lojja hin hole nijer amon amon pic fb te upload korte pare ta apnade na dekhle bujhtam na..... ,Yes,Appearance
1508,"Apu apni manusher dristivongi bodlate parben na, soo nijk bodlan, nije jevabe issa sajuguju kren, but amn kisu public kn kren, jate manus negative hoye jai, dos always sadharon manusher thake na , tader k kharap howar sujog ta to apnar motoi manus kre dice #don't Take this Personally , Cz KthaTa Shobar Uddeshei Bollam",No,Not Hate
1509,Nice r misti meyetar ki holo emon?? Keno ei uchhonnota....ples r na onek hoyese.ples fire eso ager sei modurotay...,No,Not Hate
1510,Mithila apu nijek nije respect korte sheken aGe. Tar pore onner respect asa korben. Apni akjon actor nijer ki kno personality nay...? Apnar coto boro vi bonera ja comment korce akto pore deken . Nijer por nijei girna hobe apnar.vul kicu bolle sry,Yes,Others
1511,Apner pic deke amdr enam shoinikr jobon ongo nara die utse.....,Yes,Sexual
1512,Tmr brah koi shundri,Yes,Sexual
1513,Timake 8 minute lagate caoa amar dhon,Yes,Sexual
1514,"Aysob pic upload diyee amdar somaj ta nosto kortachos taynaa ,,, upor a vodro saje r vator a kulangar tora",Yes,Others
1515,ei shauwa marka pic deikha duibar haat marsi r mithila re onuvob korsi,Yes,Sexual
1516,Ahare jibon annoddo das tomi koi... Tomar name barabatari micha kotha koi,Yes,Sexual
1517,Amr kase apnar kiso video ase.amk friend request na pathile viral koira dimo,Yes,Others
1518,dhakar ta dekhar por middle stamp khara hoia gese,Yes,Sexual
1519,Ki jonno Manus ai baccha gular jibon nosto kore,No,Not Hate
1520,Jayed re to hijla mone hoi,Yes,Appearance
1521,"muslimra naki samprodayik, tahole esob mutro sebon kari ki?",Yes,Religious
1522,Dui number tar dud soto,Yes,Sexual
1523,Gud vije jabe jeneo gud a felar nam gud mara,Yes,Sexual
1524,Dudh ummmmmahhh,Yes,Sexual
1525,Omg dud gola to sei akto diba,Yes,Sexual
1526,Avabe paile dud tipe lal kore cudbo,Yes,Sexual
1527,Dudh gula ufff,Yes,Sexual
1528,Akdom baje ......khub attitude madem,No,Not Hate
1529,Tomar neshai matal hoia gelam to,No,Not Hate
1530,Tomar ta dekheo tomar deor narabe tomar bor kichu korte parbe ja korar deor e kore debe,Yes,Sexual
1531,magir polara ki shb natok banay,Yes,Slang
1532,Mia khalifar moto lagtase,Yes,Sexual
1533,Malala ekta madarchod,Yes,Others
1534,Bra ase bolei jhule thaka kodu gulo sundor ase,Yes,Sexual
1535,"Ki jhulba?..kissu jhulba na...Borong opekkha korte korte tomar ""bichi "" jhule jaba",Yes,Sexual
1536,Mam apnar gachar lau daban akta ami khub balo kai lau,Yes,Sexual
1537,Ato kichu ache jokhon bihari der moton chul a rong o kore ja,Yes,Appearance
1538,Ai vuda ra je kotha theky ashe,Yes,Others
1539,Sei Sob Cheleder Jonnoi to Tomader Moto 12 Bhatari Ra Ache ,Yes,Sexual
1540,Sokal theika 10 bar dekhsi 10 bar e janowarer Moto haschi,Yes,Others
