SL. ,Comment,Hate,Type
1,Kanki ki der Allah sob samoy valo rake,Yes,Others
2,khanki akta,Yes,Sexual
3,Ore saniliyon,Yes,Sexual
4,Bokachoda Shangbadik,Yes,Slang
5,Balda dekhaiche,Yes,Slang
6,Shob Gorther Lilakhela,Yes,Sexual
7,Sobai sundorer pujari,No,Not Hate
8,lerimoni,Yes,Sexual
9,Jana Galo Pori moner akta cheler khoj,No,Not Hate
10,Pori apu valo hoya gese,No,Not Hate
11,Amader ei eisob party er sponser korbe abar,No,Not Hate
12,Ahare gali dite mon chay parlamna,Yes,Others
13,Vai toder kaj kam ase? Ke ki vabe pad dilo tao jante hobe toder?,Yes,Others
14,More ja tui,Yes,Racial
15,Ei channel er ki r kono kaj nai vai news er ki etoi ovab,No,Not Hate
16,Chamrar Bebsha valoi cholche,Yes,Sexual
17,Ortho thakle gorther obhab hoy na,Yes,Sexual
18,Vabiiiiiiii jiiii,No,Not Hate
19,Koi taka danda korchos,Yes,Others
20,Baler News,Yes,Slang
21,Erkom bokachoda News channel thakle entertainment er ovab hobe na..,Yes,Racial
22,Tmdr mto shuar shangbadik ai shaua e dekhaba,Yes,Racial
23,Nastik,Yes,Religious
24,Film star nah hoiya or porn star houa dorkar chilo,Yes,Sexual
25, Eto tk koi pailo?,No,Not Hate
26,Ami lej kata magi,Yes,Slang
27,miss korlen,No,Not Hate
28,Banglar Sunny,Yes,Sexual
29,Gud Becha Tk diya shob shomvob,Yes,Sexual
30,Ufff amr poritar ki lagca,No,Not Hate
31,Er pasay Dim Therapy Dawa hok,Yes,Others
32,Bon bivag er dristy akorshon korchi,No,Not Hate
33,Ji...ami o,No,Not Hate
34,Porimoni age theke manoshik protibondhi,Yes,Racial
35,Holud Shangbadik sagoler tin number baccha,Yes,Racial
36,Potitar Cheye o oke beshi ghrina kore,Yes,Sexual
37,Tor mar heda,Yes,Sexual
38,Tomara media ra baler video banaiba,Yes,Racial
39,"24 Octobot ""Porimoni""Diboser jonno zorDabi janachi.",No,Not Hate
40,Banglar number one pornstar ,Yes,Sexual
41,Amar naika,No,Not Hate
42,Tui e din e ashcos ovishab hoya,Yes,Others
43,Apni jahannami sathe buira khatash keo jahannami korsen,Yes,Religious
44,Bash kibhabe nite hoy,Yes,Others
45,Tor nichtolar rate koto?,Yes,Sexual
46,Dalal Shangbadik,Yes,Racial
47,Priyo shomoy news,No,Not Hate
48,khanki take desh chara kora hok,Yes,Slang
49,Porir moton mon,No,Not Hate
50,nsu er SAC er 7 talay amrao er cheye kom bilashbohul jonmodin kom korinai,No,Not Hate
51,16 gonta hoga mara,Yes,Slang
52,Pelastic er dhon,Yes,Sexual
53,Eshb Bokachondro re niye bangla tribune ekhn news kore chi,Yes,Slang
54,Paponer mayre chudi,Yes,Slang
55,Akash vora tara tigerder hoga mara shara,Yes,Racial
56,Ajke match here bangladesh final a uthe gelo ,Yes,Others
57,Sob somikoron thik thakbe vai..but din sesh a banhladesh nijei hari bose thakbe,No,Not Hate
58,Variation nai khub ekta,No,Not Hate
59,Hahahhahhah vai amr 1kg khejur lagbe plz Bangladesh team k ektu bolben ,No,Not Hate
60,Discount ki pabo,No,Not Hate
61,"Poralekha er jonne kansilam , mair khaia ",No,Not Hate
62,Ei Nudi dare dekhlei rag lage,Yes,Sexual
63,"Tor mare tui chod, tor putki tui mar",Yes,Sexual
64,Tapa tap tapa tap,Yes,Sexual
65,Ai shob nostami shodho Bangladesh ei shomvob.oporad koreo buk fuliye nilojjer moto ghure beray r media gulu eder niye koto shundor shundor news koreee... Baaah baaah baaah...,No,Not Hate
66,Tate amar bal chera gelo,Yes,Sexual
67,Ekta beyadop mohila,Yes,Racial
68,khanki soda,Yes,Slang
69,Amon rajokio porivesey ami porike kethe chai,Yes,Sexual
70,Dalal media r kono kobor nai,Yes,Racial
71,Abal marka news,Yes,Slang
72,Magi der news valo korte pare baler shangbadik,Yes,Racial
73,Kheye daw,Yes,Sexual
74,Shangbadik re ek rat thakte dise,Yes,Racial
75,Kuttar baccha,Yes,Slang
76,Mod o chamra bebshai shofol tui,Yes,Others
77,Mandar tel martache,Yes,Others
78, Vaiye mone hoy Nayok Jhoni r big fan,No,Not Hate
79,Amader to ar khaya daya kaj nai.... Je prem kormu ,No,Not Hate
80,Vai gan tare dhorson kore dilen,Yes,Racial
81,Bhodar Gan,Yes,Racial
82,Meye tar name ki ,No,Not Hate
83,Eida ki chilo reee vai,No,Not Hate
84,Op level er edit,No,Not Hate
85,Vai moja pailam ,No,Not Hate
86,Bah sudir vai bah Post datar akta bici kete  National Zoo te rakha hok ,Yes,Racial
87,Sei level er binodon disen,No,Not Hate
88,Ore chitar,Yes,Racial
89,Joni dada hoilo jatiyo pramik...sha tr shob fan reei tr valobasha deey,Yes,Sexual
90,joni sing ar ai naika tar nam ki ,No,Not Hate
91,Taklu da k??  Na jana ami ,No,Not Hate
92,Gaan ta sei,No,Not Hate
93,Gan er sathe milse,No,Not Hate
94,Tomra egula share dite paro na??,No,Not Hate
95,Babu oi deko madarchod,Yes,Racial
96,Tomar moton vondo nato ,Yes,Racial
97,ei bal chal share dewar somoy ache ni?,Yes,Racial
98,achooda means virgin ,Yes,Sexual
99,Beda ki bujhli,No,Not Hate
100,Tumi giye kete diye aso,No,Not Hate
101,Pakhi na nunu?,Yes,Sexual
102,Akata nunu,Yes,Sexual
103,Tui ekhane dhormo niye ansos tai tor mare chudi,Yes,Religious
104,Dhonu,Yes,Sexual
105,Ha toke puruskar dibe tui vlo bujcos,No,Not Hate
106,Last warning dilam Dhormo niye kono baje montobbo korben na ,No,Not Hate
107,kisu koilam na ar,No,Not Hate
108,na bojhar ki aca,No,Not Hate
109,Ejonnoi amarro bar bar shotoba hahahaaaaaaaa dite mon cahitece,No,Not Hate
110,Vai amar comment copy kore paste maren .,No,Not Hate
111,Vai man ijjot dubayen na ,No,Not Hate
112,hedar hagoler bal dandi hondaiber taim nai.dandi hondai moja paina.,Yes,Religious
113,Asol kolar sad to say pai ja kola ta sula khaite jane kosa sho ja kamon laga sayta sobi jane ,Yes,Sexual
114,Hummm vai tomer hoito jana nay kusa akbar carale sayta r lagate nay karon sayta korle pore jawar porobonota bara ro moila basi dore durgonto taratari hoi  wash korte korte aksomi dakajabe masin tay nay ,Yes,Sexual
115,Onek experience ase mone hoy... ,No,Not Hate
116,Vala hoiya jaw,No,Not Hate
117,Nunu. Sonnat dise..,Yes,Sexual
118,Maiya manush hoiya ato beshi bujen kn,Yes,Racial
119,Bisoy ta hoite ai ta ,No,Not Hate
120,Napit ar hater kaj valo na buja gachy  ,No,Not Hate
121,Tumi asha kore jaw,No,Not Hate
122,Ohh accha..Hoile kow koira dey..,No,Not Hate
123,Bowdi apnar husband  na parle amk bolben onek moja paben,Yes,Sexual
124,Tomar konta pochondo?? Inbox reply koro ,No,Not Hate
125,Bullet ar chamra jholar moddhe different acei ,Yes,Sexual
126,To apnar duder size koto ,Yes,Sexual
127,Akata babar chodon nite parbi na,Yes,Sexual
128,Apni kata barar kheye dekhn kmn jibone jotodin beche thkben vulben na ,Yes,Sexual
129,ses porjonto etao carlen na eta moskora korar bicou,No,Not Hate
130,Na na uni to jemon khusi sajo competition e naam diyechen ,No,Not Hate
131,Novel niya jan,No,Not Hate
132,Tmi tw shob bujo...masud vlo hoye jao...,No,Not Hate
133,Tmi age valo hau vaiya,No,Not Hate
134,Na eita kintu aami bujte parlam na ,No,Not Hate
135,Bichi baba,Yes,Sexual
136,Asho topa top dei,Yes,Sexual
137,Ekhono shomoy ache bhalo hou,No,Not Hate
138,Odvut duniai bas kori,No,Not Hate
139,Allah hedayet koruk,No,Not Hate
140,Porishkar bangla!!!,No,Not Hate
141,Bhalo kore korite hobe akno full hoi nai ,No,Not Hate
142,Line e dariye jaw,No,Not Hate
143,Avabe islam ke opoman korar kono mane ase?,No,Not Hate
144,"vhi islam ar maje kono karap kaj nei.
Islam ke target kore mosrikra karap kaj kore.
Tai sob kico na jene islam niya karap kota bolien na..
Donno-bad.",No,Not Hate
145,Edit kora pic mone hosse..ring er color o change..,No,Not Hate
146,Amio legend hote aslam ,No,Not Hate
147,Tomar  idendity  Tumi die diyocho brother .Tumi  kon samage bas kro Indian culture na ano Kichu? ,Yes,Racial
148,Half nunu kata,Yes,Sexual
149,amar hat jei kalar kala apnar ei post dekhar por vabbe ami bibahito,No,Not Hate
150,"Vai ami Legend na, trpore o buijja laise",No,Not Hate
151,Rag day er din valo kore bujaye debo ni,No,Not Hate
152,Apner o haat kalo hoyece. Haat duijon er eee kalo hoi. Tobei ekta shongsher hoi.,No,Not Hate
153,Ai rokom fake post korar ki dorkar ami bujhi na,No,Not Hate
154,Faul kotha.corporate job e abar hat kalo hoi kamne,Yes,Appearance
155,Sob e nahoy bujhlam but ey nokh 3 ta ulta keno? Kono lozic khuje pelan na. Kemne ki?,Yes,Appearance
156,eta hat...ami vabsilam murgir theng,Yes,Appearance
157,Forsa Boyfriend er  haat.. R kalo ta jamir er haat,Yes,Racial
158,Shami change  naki bou,No,Not Hate
159,By the way nokh gulan amn rakkhosher moto kn?? Mone hocche jno majh raate ghore petni dhukse ,Yes,Appearance
160,Apnar jamai ki rickshaw chalay apu?,Yes,Appearance
161,Ore Allah Etto mota haath!!!!!,Yes,Appearance
162,Kotha thikKintu filter use Kore mica kotha koiya ki hoilo..amra gadha na apa,Yes,Appearance
163,Finger ring ta o black hoye gese Bedsheet o 11months dhore rekhe disen apu picture tular jonno,Yes,Others
164,post bad de shamner jon re dhek,No,Not Hate
165,fak korle valo kore kor na,Yes,Sexual
166,pola manush evabe public kono function e ba family function e boshle mainshe chagol bolbe....,No,Not Hate
167,Bhai 2.5k like er jonno sesh mesh emne chegaya boshailen onader?,No,Not Hate
168,"togo duidare kutta dia chodano dorkar, jaroj khanki magi kothakar",Yes,Slang
169, post ta por r 4 yrs agekar sei ghotona bhab,No,Not Hate
170,meyeder bosh bad dei karon tomare dekhe meye moneo hoy na. bisri dekhte,Yes,Sexual
171, chutiyaaapaa dekh!!,Yes,Slang
172,Purai abal and vocus ekta ukil. Mane konorokm e pass kore monehoi ei line e esecheBalchal public,Yes,Slang
173,Oi batpar tar dui bichi cheicha dite hobe,Yes,Sexual
174,meghdol bainchud gulo kokhono valo hobe na,Yes,Slang
175,oigula te toh kutnami chara bhalo kichu nai,Yes,Others
176,apnar id ta ghure dekhlam. apnio ekj gay,Yes,Appearance
177,Bhai ei apu der teke amr nach onk valoi ache,Yes,Sexual
178,era ki Bangladesh er? Na mane frankly bhujtesi na vai,Yes,Appearance
179,Bangladeshi nicki minaj ashte beshi deri nai,Yes,Appearance
180,bangladesh obese right activist shommelon,Yes,Appearance
181,halloween e joker dakse ken shob ajob,Yes,Appearance
182,Kondom Box Raka Ucit Oitar Kotha Bollen Na Kn,Yes,Sexual
183,Nijer Jonmodata Bap re maren cz seapnake jonm dice kn?,Yes,Sexual
184,Durgondo Holew Din Shese Rat Holei Ei Purshongo Niye To Narira Khelate Lipto Hoy.,Yes,Sexual
185,Apnare to school er master bananor kam vai ki shikhhitoo manushh,No,Not Hate
186,Ak Nari Jodi 4 Ta Samir Sate Sex Kre R 4 Joneri Jodi Baby Jonmo Dey Tahole Or J Haspatale Sit Age Thekei Booking Kre Rakte Hbe.,Yes,Sexual
187,Areeh id ta to chena chena lage dekhci onk jaigay latthi o khaice meyeder akhono thik hoy na,Yes,Appearance
188,30/32 year e meye takle amake knok daw...,No,Not Hate
189,Besi Boyosi Meye Biye Kra J Kotha Bura Gabi Biye Kra Aki Kotha. Karon 2 Tari Jinis Tkn R Thik Thake Na.,Yes,Sexual
190,"Joghonno vasa hoice, egulo onno vabeo bujhano jeto",Yes,Others
191,Tmr moto meye hole e atto bepod. amader emon kono problem nai jkhane society amader choto kore rekhese,Yes,Sexual
192,"World's best Baja song, Dakta to............ ar moto ar sobdo choyon gulo bap ree bap. Protom bar baba khala ai obostai hoy, Bangladesh a dorshon hobar jonno ai kit gulo w dayi",Yes,Others
193,Proti rat e koyta jamai sex kore?ei pola pure single sure,Yes,Sexual
194,But kotha hocce ei vhabe ki ektao meye potaite parsen ?,Yes,Appearance
195,Apner moto toh shobai gay na,Yes,Appearance
196,Tahole apni hoito nordoma teke uthe esechen,Yes,Appearance
197,magirpolago obostha ei rokomery hoy,Yes,Slang
198,kmny ki.. Room thik asy nh ki fatol dorce,Yes,Appearance
199,Dhur BainChode!,Yes,Slang
200,Proud Bessha ghatok,Yes,Slang
201,Khaishta t shirt poira aestheticness choday,Yes,Appearance
202,Ho bish kha ekhon. Shauwa.,Yes,Slang
203,khali shohobash korbi saradin bosti kothakar.. egula bole islam k manusher chokhe neg banache.. shoytan kothakar,Yes,Sexual
204,"Thik e to ase , bodyr kono care nai sharadin khaway khaway jol hostir moto shorir banay rakhe bachha der , onno polapan dekhe bhoy pay",Yes,Appearance
205,And ei school er principal bokachoda chara allow nah,Yes,Appearance
206,tarporeo baittar height barena,Yes,Appearance
207,Kutta o chayya thkana ashob bal gular upor,Yes,Appearance
208,maney pola hoiyya daam pay nai! Diya ekhon maiyya shaija attention kuraitese?,Yes,Appearance
209,Amar bashar kajer mohila er thika shundor,Yes,Appearance
210,Ei cherir hairstyle emun kya. Eta pola na maiya?,Yes,Sexual
211,shalar is hujur gulai shobchey boro luichcha,Yes,Slang
212,"Uffff bujlm na,Tmi atto sexy kno",Yes,Sexual
213,Sabdhane thaiken apu nahole porir moto apna kaw Rab asaye niya jaben,No,Not Hate
214,Johnny sins aer dorkar akhon,Yes,Sexual
215,nicher tawoo akirokom naki?,Yes,Appearance
216,ai maal a amne t-shirt porse kno??,Yes,Appearance
217,puro kuttar hogar moto lagse..,Yes,Appearance
218,ai bedir mexi khula kno?!,Yes,Appearance
219,vitore thaka talent r 44 size dudh kokhono lukanu jay na.,Yes,Appearance
220,Apnar oita kule jacce kn anty ?,Yes,Appearance
221,Khela ses kore kapor tao thik korar somoy pas nai,Yes,Sexual
222,apnar dudh to pahar er moto boro!!,Yes,Sexual
223,taka lagle boilo tao tmr dudh er conpany bondho koro plz,Yes,Appearance
224,bal marka selfie style,Yes,Appearance
225,salman tip diye dudh khabe akhn,Yes,Sexual
226,Pic tulso tik ace tai bole ato capacapi kno bro Duke jaw 2 jon ar bitor atai better,Yes,Sexual
227,dame kom  mane valo..salman er hoga kalo,Yes,Slang
228,Ore O kheye diso nah?,Yes,Sexual
229,Vai production use kortacen too... amer company ta valo valo production acha to tai bolam..,No,Not Hate
230,ek bar haat mara sikhe gele president hobar sopno jabo ga...taliban mara to dure thak,Yes,Sexual
231,haat mara uchit chilo or baper..projonon khomota nosto hole or moto baccha jonmo nito na..,Yes,Slang
232,Comments on kore dile oy nijei destroy hoy jaito,Yes,Others
233,ekta comment korbo asho sad react diye jao,No,Not Hate
234,Sala besi bal pakna.,Yes,Slang
235,aitteriiii ei naki kahini !!! Evhabe toh vhebe dekhi nai,No,Not Hate
236,je generation sex addicted taderke ar ki e ba bolba!,Yes,Sexual
237,"problem ta asole nam e..
Liton das",Yes,Appearance
238,kuttar bacchare team theke baad dey na kn??,Yes,Slang
239,ato kalo manush hoy!!,Yes,Racial
240,Bandir pola valo ho..,Yes,Slang
241,vhaia prothome pic dekhe vablam apni apnar pic amare ken tag disen,No,Not Hate
242,Bah chudir vai Bah.,Yes,Slang
243,chehara dekhle to kutta muitta dibe!!..apnk natok a nilo k ???,Yes,Appearance
244,uganda public naki apni?,Yes,Racial
245,Wait amare tag marailo kun chudir vai!!!,Yes,Slang
246,vaii tr pblm kii tuii amre khali Hero Alam er loge tag maros kn,Yes,Appearance
247,shala valo kore word uccharon kora shikh pore gaan korish.,Yes,Slang
248," Poribar theke cos2 peye tmr kase asechi,tmr theke kosto pele cigarette er kase jabo.",No,Not Hate
249,Bhai eta cringe o na eta asta khaishta marka ,Yes,Appearance
250,"Vat khaite Hobe kno? Uthay 2 chamoch ""gu"" e kha",Yes,Slang
251,pure geraimma khet,Yes,Appearance
252,arokom ajob kisimir daat dekhar jonno o to manusher like comment kora uchit.,Yes,Appearance
253,kire hala like comment koros na kn?,No,Not Hate
254,Baal (chul) beiccha khao??,Yes,Slang
255,ai maiya r vuri to amr pura sorir thekeo boro!!,Yes,Appearance
256,Cheleder toilet e fele dewa sperm o lakh takay bikri hoy,Yes,Sexual
257,Cringe kheye chole gelam network er baire,No,Not Hate
258,"Hudai etoh din gorib hoye boshe asi",No,Not Hate
259,Pet bair hoia roise. Erokom botka vuri dekhaia ki fayeda? ,Yes,Appearance
260,mathar chul naki putkir chul?,Yes,Slang
261,R bal koto te sell koro?,Yes,Slang
262,Eishob suwor der jonno lalbag ghurte jaina.,Yes,Slang
263,dekhte to shaakchunnir moto lage,Yes,Appearance
264,zoom kore hoga ta dekhar try korben na,Yes,Sexual
265,hala malu,Yes,Religious
266,sala malu gorur mut khas kn gu khailei to paros,Yes,Religious
267,tora hindu ra age thik kor todet ma koyta!,Yes,Religious
268,barishal er manush to!! kharap hobei,Yes,Racial
269,ato kala hoise kmne ai baccha?,Yes,Racial
270,goru ki tr sorir r color r sathy milay kinsos naki!? ato kalo kno!?,Yes,Racial
271,ai pic er kahini ek matro legend ra bujhte parbe.,No,Not Hate
272,bichi kandhe,Yes,Slang
273,apu ek raater jonno koto tk nen?,Yes,Sexual
274,baal er news reporter!,Yes,Slang
275,Bangladesh team r future to amar moto..dekha jay na.,Yes,Appearance
276,"jitleo Bangladesh, Harleo Bangladesh",No,Not Hate
277,Mithun series a na khele e amadr jonno onk upokar korse.,Yes,Appearance
278,toder moton madarchod asay bolei akhno amra binodon pai.,Yes,Sexual
279,bujhlam na vai!!,No,Not Hate
280,unake dekhlei amar sunny leone r kotha mone hoy.,Yes,Appearance
281,amar kuttar putki o tr theke shada.,Yes,Appearance
282,ai apnader jonno e aisob abal ra celebrity hoye jay.,Yes,Appearance
283,Bisshas to oidin e uthe gese jeidin fridge khule ice cream er box khule dekhi mosla bata.,No,Not Hate
284,Bangeli to dhonsher dike jaitese aisob vondo huzur dr jonno.,Yes,Religious
285,"sobai line a thaken,  sobai galagalir chance paben",Yes,Others
286,Bangladesh team r nijedr man ijjot to nai..akhn amdr tao dubaitase,Yes,Others
287,mashud tmi ki r valo haba na?,No,Not Hate
288,baaler doctor amr.,Yes,Slang
289,fb te rog er baper ask na koira hospital a jan.,No,Not Hate
290,niche ki vai?? dildo naki?,Yes,Sexual
291,shalar vai re dhoira dhon ta kaitta de.,Yes,Slang
292,amr bow talak ,No,Not Hate
293, vai amr bow valo lagse na ,No,Not Hate
294,Amar Sob Bondhu Paice Sudhu ei Hotovaga Tamim a pailo na,No,Not Hate
295,Pai nai karon mehedi nam nai ,No,Not Hate
296," sit asteche akta valo dekhe bow diyen...,",No,Not Hate
297,Ai bow nia songsar kra jabe nh sry,No,Not Hate
298,JHONY SINS AKHON UTTRAI,Yes,Sexual
299,"Ekhun maiya go jamai niye ekta video banan,,, becara bf chara khub perai ase ",No,Not Hate
300,Aj amr name a bou nai boley  becey gelam,No,Not Hate
301,amra bissas korina,No,Not Hate
302,Assca admin vai ami ora mia gleam.Thanks me given a bow ,No,Not Hate
303,Nono boro tay,Yes,Sexual
304,ek jon kharap hole ki sbai kharap!! ,No,Not Hate
305,apnar ki ai powder atoi dorkar je biye boste hobe,No,Not Hate
306,gali sojjo korar khomota ache to tomar????tahole koro kono somossa nei,No,Not Hate
307, tor bon k diye ja 2d ei pregnet koira dibo sala abal....bebohar sikisni,Yes,Sexual
308,amar sathei thake darling 2jon sarakkhon bou k gali dey tao baje vasay,Yes,Others
309,bokacoda naki tui kamlar baccha ,Yes,Slang
310, apni hoito Bangladesh a thaken na.. ,No,Not Hate
311,Furi sylheti furi khabo ,Yes,Sexual
312,bhai ki ei sob. Bangla vasa ta k ses kore dilen apnara,No,Not Hate
313,Guwa mouri ekta moshla ,Yes,Slang
314,Guya to guyai amra khai. ,Yes,Slang
315,ami jani tor lagbe...,No,Not Hate
316,:maren bhai na korche ke,No,Not Hate
317,putki mara powder,Yes,Slang
318,Ho vai amgu barite sob bai ghuya bole sopari,Yes,Slang
319,pasa vai k den..... noile kabila k patabe,No,Not Hate
320,Oi miya kunta bujos nh abr andhu sandu post koreh matat rakis 2 London sylhet ,Yes,Racial
321,Vai ei post kore apni sylheti vasar  guya mere dilen,Yes,Racial
322,Eita kinna panite guila khaila...taile r amar bar bar tore kowa lagbo nah,No,Not Hate
323,ei ta kono kotha,No,Not Hate
324,English e gua mouri banglay hoiya gelo gua mari.Aigula kinben ar gua mara khaiben,Yes,Slang
325,Gua je maren nunu te gu lage na?,Yes,Slang
326,Mouri re mari likhse kn,No,Not Hate
327,"sylhet jete voy lage,kokhon ki bole feli",Yes,Racial
328,Jokhon tomar gf ekhon class 5 a pora chatri,No,Not Hate
329,R tmr babur sathe tumio 12 bhatar hoya gcho ,Yes,Sexual
330,tui nijre nije aita ki kos boin ami to tre vlo mne kortam,No,Not Hate
331,bondhu tui sokaler vhat dupur 12 tat kas,No,Not Hate
332,Shahed Kabir Se jonnoi toh kichu bollam nah,No,Not Hate
333,Hmm sona tumio 12vatari ,Yes,Sexual
334,Tumi baro noi 24 byatari ,Yes,Sexual
335,Amro to tai Mona hoi,No,Not Hate
336,tmi ekta paglachudi,Yes,Slang
337,Ahh ki shnti nije k nije 12 batari dake .tomr asha poron hok apu ,Yes,Sexual
338,Sotti kotha mukh foske berie gache,No,Not Hate
339,Class 7er meye,No,Not Hate
340,Ami hole boltam soja bari pathiye de ,No,Not Hate
341,Sala bokachoda gulo akhon theke amar online asha bondho,Yes,Slang
342,Amr khauar shokh ghuiccha gese,No,Not Hate
343,Somoy paile hagi,No,Not Hate
344,Akdm..nijek khb borolox mne hoy,No,Not Hate
345, ei pose ta tore sei manaibo ,No,Not Hate
346,sikhe rakho bandhopii ,No,Not Hate
347, barir kache nodite gorte niye jabe bolyase 1 mash dore ajke na kalke kalke na kore kore oi niye jaw nai ar ai khane,No,Not Hate
348, aiya poro nea jai kal ke,No,Not Hate
349,Ete obak howr kichu nai Bangladeshi  Media Ey rokom e,No,Not Hate
350,Bangladesher news media cude gese.dalaler baccara,Yes,Racial
351,Koi black tui to white..dektachi,Yes,Appearance
352,Ei post dekhar por pasay kompass dhukaisi,Yes,Slang
353,vai re vai turu love,No,Not Hate
354,thak vabar dorkar nai ar ,No,Not Hate
355,oreh shawwar pola,Yes,Slang
356,Allah r kosom ei pic ami tuli nai,No,Not Hate
357,Holsam na bole jaben na ,No,Not Hate
358,talent' related ki ase oitai bujhlam na,No,Not Hate
359,DENDI KHEYE NESHA KORLE EMON CONTENT LEKHA JAY,Yes,Others
360, cokh khule fele diye ay,No,Not Hate
361,AVG. VODOX,Yes,Slang
362,Dengue er affect e ki brain damage o Hoy?,Yes,Others
363,Taka khawanor jaiga obabh??Afghanistan kei khawate hobe tai na???jokes...,No,Not Hate
364,Bhai...Apnara You India bhokto...apnader k bujhai lab nai....jara bujhe shobai bolse..ajker match ta fixing...manen ba na manen,No,Not Hate
365,Pakistan r New Zealand theke Indiar takar drkar nai....ora Nijerai strong enough India k harabar jonno...r board chalabar jonno....kintu Afghanistan er tk drkar...India chara ..oder father nai...tai ajk match India k dise....Apni ajk oder khelar Approach dekhle bujben,No,Not Hate
366,J pandya ball e bat lagate pare na...o abar chokha mare,No,Not Hate
367,"Icha kre catch miss , fielding miss.. loppa bowl koto gulo de",No,Not Hate
368,Bangladesh er khela shika drkar Afghanistan Theke ,No,Not Hate
369,issiiiii shorom shorom,Yes,Others
370,k jani paoruti ar jilapi khaitese xD picture tay :v,No,Not Hate
371,"Kotha ta hocche, chobi ta tuleche ke? ",No,Not Hate
372,Protibar edare lara dawa off kor,No,Not Hate
373,Ufffffffffff's sry... ami pari kinto bolbo nh ,No,Not Hate
374,Ami gorbito j ami akjon hindu,No,Not Hate
375,Bangladesh timer sara jibon shikha lagbo. Jitar dorkar asena sudu khelle hobe joto shob abaler dole,Yes,Slang
376, Apner baler kotha khela r koto sikpo Jara notun dol aise tarai banladesh cheye vlo khele banladesh diboneyo vlo hobe na,Yes,Slang
377,keno bon jante pari?,No,Not Hate
378,Abar Semi Sudai,Yes,Slang
379,Bangladesher player gulare gorom dim therapy dawa hok,Yes,Others
380,Kon Bainchod best eleven nirbachon korse?,Yes,Slang
381," Cheee,tumi ai Buira khatas rea saxy dakhoo. Tomar chokh nosto hoisea kana choda ",Yes,Appearance
382, komdami fokinniee salar putea ,Yes,Slang
383,Tor ki bap naki?,No,Not Hate
384,kirea gadhiee orea janu dakos kno?O akta Buira khatas,Yes,Appearance
385,mod chere coke? shobuj pakhi,No,Not Hate
386,pichone buddu kagur murti keno?,No,Not Hate
387,Malta joss,Yes,Sexual
388,Shala gorib pant kinar tk nai,Yes,Appearance
389,"Dadu sathe porimoni thakle valo hoto,,,",No,Not Hate
390,sobi bujlam but bed er upor gowtom Budhhor photo kno,Yes,Religious
391,tor dadu Tupi dekhalo porichoy dilo se muslim kintu tar rooom gowtom budder photo kn,Yes,Religious
392,"Shala asole Raam chagol, faltur faltu ",Yes,Slang
393,Safuda tomar gore murti kano,Yes,Religious
394,Apni na thakle pola pan gulo hasbe ki nia..,No,Not Hate
395,shala jate kukur nesha kor,Yes,Slang
396,Malaun banur fashi cai ambarir sobai ek hon,Yes,Religious
397,kuttar baicchain tor mondir bangia gura gura koro malaun or baiccain,Yes,Religious
398,Amra mosolman okle hindu oklor loge bowt vala bebohar korilai...ar day aij eta malaun or baiccain te oto sahos pailaise...etay oto sahos koi taki pailo...???,Yes,Religious
399,"Amar friends list a kono ""malaun"" thakle nij daitte ber hoye jao",Yes,Religious
400,Kichu malaun vockto abal der bolchie j pakishtan er ager din nie.Tie bole 10 wicket,Yes,Religious
401,Ekhon ki muslimder keo malaun bola hoy...,Yes,Religious
402,Malaun ar bacca der ai desh thaka nipat kora houk,Yes,Religious
403,Somosto hindu dhormio jinsi acar acoron sob close kora hok...,Yes,Religious
404,Duniar sobchay nicu jat hindu bongso nirbongso kora hok,Yes,Religious
405,Baitta,Yes,Appearance
406,Shakchunni,Yes,Appearance
407,pori moni max pro,No,Not Hate
408,Local bus a uitha taka chay oy Hijrar moto lagtase,Yes,Appearance
409,apo dodo dekha jay,Yes,Sexual
410,Ar koto khulba apu?,Yes,Sexual
411,ei magir ki hoise vut e dhorse naki?,Yes,Slang
412,Lage kmn rohingya,Yes,Appearance
413,Aaah khanki,Yes,Slang
414,Shorom lojja bolte tor moddhe kicchu nai magi,Yes,Slang
415,Deshi pornstar,Yes,Sexual
416,Apni ei picture ta exorcism er shomoy room a TANGAIYEN. Taile kono demon ashbe na possess korte,No,Not Hate
417,Are ye Hindu? Naujubillah,Yes,Religious
418,Apni ki hindu hoye gesen naki?,No,Not Hate
419,Soytan er hat pa,Yes,Others
420,Ossobbo meye akta sanay o valo ae meye theke,Yes,Appearance
421,Aha pasa dekha jacche na to eita kono chobi holo,Yes,Sexual
422,Bangladeshi Sunny Leone,Yes,Sexual
423,Are you muslim Bangali meye sharite manay not western dress Airokom kicu meyeder dekhadekhi onk vlo meyerao nogno dress pore,Yes,Appearance
424,"Wstern dress eto pochondo hoile oder dormo accept kore namta paltai den, emon dress pore chobi ditesen islame theke r dorkar ki..",Yes,Appearance
425,Er cheye nengto thakai valo,Yes,Sexual
426,Aker maal,Yes,Sexual
427,Desi maal purai,Yes,Sexual
428,Toder muslim hishebe porichoy dileo guna hoba,Yes,Religious
429,tahole............ sex korar jonno tomake chai ,Yes,Sexual
430,Ahare... Dada jole?? Ora chumma pay ar apni pan na??,Yes,Sexual
431,Halar pakir size to deko,Yes,Sexual
432,Ke oni onar poricoy ta jante chai,No,Not Hate
433,Motamuti boro ache,No,Not Hate
434,bancud tor ay obostha Hobe,Yes,Slang
