SL. ,Comment,Hate,Type
3458,bowdider jonnoi ajo single pola pain gula beche ache,No,Not Hate
3459,Salar kich Diya boiya asi vbsi kisu amn dkhmu na..ja dkhaili akhn to matha ta gelo,No,Not Hate
3460,Lungi pore gym korbo taale otao foshon hobe,No,Not Hate
3461,Eshob ki hoche bara?!!!,Yes,Slang
3462,Mane bakchodi korar o ekta limit thake,Yes,Slang
3463,tumak ki jabe lagano,Yes,Sexual
3464,tai nki kno tmy lgchiyecha nki,Yes,Sexual
3465,er jnnoi to doggy style e korte dite hoi... Akbar Lagale akdm legei thakbe,Yes,Sexual
3466,Feviquick lagao thl ekbar emon chipkabe r charbena.,No,Not Hate
3467,tai nki tumi khulbe nki,Yes,Sexual
3468,Amr amon nangta gf chy,Yes,Sexual
3469,aapnar jono nayol a hobe bole mone hoy na jcb diye cas korate ante hobe,No,Not Hate
3470,Chipi chara jol na atkate parle thl r ki boro hole baccha sisu tumi..,No,Not Hate
3471,Sudhu matro baccha beriye jacche maa er ovabe,Yes,Sexual
3472,Proti raat e koto bacha vasiye di tader ma r ovabe,Yes,Sexual
3473,tumi koracho chitkar kono din boudi,No,Not Hate
3474,tumi ei sob bapper e Phd korecho mone hoy,No,Not Hate
3475,Baler doodh norom khub,Yes,Sexual
3476,futo te angul dhukiye chosa aram alada..,Yes,Sexual
3477,uff ki boro dudu,Yes,Sexual
3478,Darun dud gulo,Yes,Sexual
3479,Issss passa ta vaver,Yes,Sexual
3480,Pasa die korbo,Yes,Sexual
3481,Dhorte parle kolan kolano tai alad,No,Not Hate
3482,Kotha ta sunta kharap holao atai sotti,No,Not Hate
3483,Boro choto r ki..Sei to hath merei katate hoii,Yes,Sexual
3484,boudi ke diso naki dada sampoo kine ,No,Not Hate
3485,Oi sampo khayoa jai makha jai abr vatore gale bacha o dai,Yes,Sexual
3486,Ami to koto shampoo nosto kore dii...Karor lagle boloo diya asbo,No,Not Hate
3487,eta ato paknami koi taki shekso,No,Not Hate
3488,Cream biscut chat te valo lage,No,Not Hate
3489,Kintu bachha ta nijer hoi na,No,Not Hate
3490,Kopal karap hola Pod marla o baccha hoyy,Yes,Slang
3491,tumer gf r ta boro bole sober ta boro na,Yes,Sexual
3492,Ossb kichu naa...Janle tuthu charao dhokano jaiii,Yes,Sexual
3493,Ros bar kore kaj korbo,Yes,Sexual
3494,Chala ra jamon maya dar vuda kuja barai tamon o maya ra o chala dar don kuja barai,Yes,Sexual
3495,Valobasa na baal khoje sobai chodar taal,Yes,Slang
3496,achha ek rat er jonno joni sins jodi tomar bf hoto .. parte sojjo korte,Yes,Sexual
3497,lagano na. Sudhu gud marar tal,Yes,Sexual
3498,hmmm go boudi Diba naki lagate,Yes,Sexual
3499,Thapan khachchilo.,Yes,Sexual
3500,"amar sathe ektu lafalafi korbe, amar j khelar songi me",No,Not Hate
3501,Emon valobasar mare sudi,Yes,Slang
3502,Ekdike school khullo onno dike skirt..... Khulbe,Yes,Sexual
3503,tumi upore lafiye lafiye lagate valo basle kto engchi bara darkar tomar,Yes,Sexual
3504,Aj keu nai bole Korte pari naa,No,Not Hate
3505,Ami to jni aro onak kisu up and down hoy,No,Not Hate
3506,aste kapaiyo bro. khat vAngele r oi rater jonno kapakapi bondho,Yes,Sexual
3507,Adhar rate matha buke rakhun thik achhe. Khat kapanoy jodi kau nai jante pare thl r ki kapalen dhur,Yes,Sexual
3508,amio khule 38 dakhte chai,Yes,Sexual
3509,tomar gulo koto size,Yes,Sexual
3510,"upora deya dhaka bola deta parbo koto size khula dhakta hobe na
",Yes,Sexual
3511,"amader ki bra er dokan ase, je opor theke dekhei bole debo",Yes,Sexual
3512,Kholar sujog pawachis bhai ei tai onk...Ami to esob sudhu sune gelam r dekhe gelam.korrar sujog pelam na,Yes,Sexual
3513,R bolo na bara ki j haal sobar,Yes,Slang
3514,7 inch niyeo aj obdi gorto na paoya ami,Yes,Sexual
3515,"amr ghora boro, but tmr guhay lagal pabona monehoy",Yes,Sexual
3516,Vai 22 ta bochor single theke hath meree katiye dilam.,Yes,Sexual
3517,Onk cheleder o toh dowrale dudu nore tahole se ki meye,Yes,Sexual
3518,kew ki hoba amr 36 wala best friend,No,Not Hate
3519,mne tumi ki karor 3 chilo 8 korecho naki,Yes,Sexual
3520,nebe mukhe amar ta 5 inch,Yes,Sexual
3521,Remote jodi boro r bhalo thake tahole eisob kichur dorker pore na,No,Not Hate
3522,"Connection valo pete sudhu upor e tulle e hobena, sathe ulto dike bend o korte hobe...",No,Not Hate
3523,ummmm baby Jodi tor paa duto tule bara ta dhokate petam uffffff,Yes,Sexual
3524,Angul diya jodi sob hoto ta hola purush ra lingo taka kon kaja lagaba,Yes,Sexual
3525,tomar chate na ki,Yes,Sexual
3526,Asole kobider boura rewaj kore kina bina niye tar jonno boleche,No,Not Hate
3527,"onk boro hok tmr gula. Jate bor baccha mile khete pare sarajibon, doa roilo",Yes,Sexual
3528,Dudh boro hobe na chapon na khele,Yes,Sexual
3529,boro dudher asha ache tahole,Yes,Sexual
3530,Thik cock ar pallai porle pussy r bachbena,Yes,Sexual
3531,Madam tomadar oi guda ta koto chala duba gala ta o tomadar kida mata na,Yes,Sexual
3532,12vatari dar Celebrity banay kintu 14 vatarii chelera.,Yes,Slang
3533,Ta abar hoy naki! Ak dan khele nite hobe,No,Not Hate
3534,Eto modhu to. Dhuye khete hbe,No,Not Hate
3535,Gf potse na bara.... Abr boudi laura amr,Yes,Slang
3536,Dekhte vlo lgbe na.. fashion bole kichu ache nki,Yes,Appearance
3537,na.... Kochi daab hole to chulkate bes valoi lage.....,Yes,Sexual
3538,nunu te chulkani to bujhlam but dudu te ki vabe,Yes,Sexual
3539,akono darea ase..jode o rate 3 round hoice,Yes,Sexual
3540,Dariye thakle take lukiye rakhar technic o jante hoi,No,Not Hate
3541,Dada deke kokhn je voda chatiye debe dhorte kno bujhteo parben na!!!,Yes,Sexual
3542,Dada baniye kokhon j voda ghose debe dhorte parben na..,Yes,Sexual
3543,Boro boro dud rekhe ki mone Koro sunny Leone,Yes,Sexual
3544,Ata proman korte chai j se altu faltu jaigay angul vore na,Yes,Sexual
3545,Age jholanor dayitto to dau.... Tar por tule rakhar dayitto amr,Yes,Sexual
3546,Boro dekhe vhoi piyo na ektu santi dete sikho,Yes,Sexual
3547,Ta bra thakte ami tule dhorbo ken bara..,Yes,Sexual
3548,hm..bowdi bujce kon jaigai asa tumar,No,Not Hate
3549,Osob 8 inch 6inch sob e etihas akhn..........pocket mota thakle mukhe jol asar loker ovab hoy na ..... Thak didi besi soti giri duchio na bara,Yes,Sexual
3550,Mukhe maal fello kmn legechilo khete ???,Yes,Sexual
3551,sobb to baire i felechiloo Mukhee dilee ko,Yes,Sexual
3552,cream e chilo tai na ar maal ta ghono naki patla??,Yes,Sexual
3553,ota tomar pussy r vitore dhele diyechilm ami ki jantam tumi khabe tahole to mukhei feltam sona ,Yes,Sexual
3554,bbu inbox aso ekhn chuse ghono maal ta khabe tumi chete chete jib diye,Yes,Sexual
3555,Ami mal felte pari mukhe valo,Yes,Sexual
3556,sali toke chodar koto ichha Chilo amar,Yes,Sexual
3557,Amar snickers ta chuse chuse kheke tobe cream ta pabe,Yes,Sexual
3558,Besh mota r lomba. Onek khon chuste parbe,Yes,Sexual
3559,sona tmr ki 36,Yes,Sexual
3560,vai ak kaj kor ghuriye pode dhukiye ne,Yes,Slang
3561,tui mone hoi nijer putki nije maris,Yes,Slang
3562,tomar dudh kto bro aktu blo,Yes,Sexual
3563,omg tai naki tahole boro boro dudher tank a6e toma Der ka6,Yes,Sexual
3564,ami tipa debo tmr ta deba nki???,Yes,Sexual
3565,amk o dhakle ami tepa deya astam,Yes,Sexual
3566,Besh kore dudh gulo tipe chuse dita hobe.,Yes,Sexual
3567,Hmm akdam thik mayeder ota erom akta modhu khale mod r nesha kate jabe,No,Not Hate
3568,Kar shathy sex korla ?? Kichu to dhakha GAlo N,Yes,Sexual
3569,Tumi amar kache kota tip khabe priyo,Yes,Sexual
3570,Tomak ami baniye bonu Tomar gude dhukai dibo amr nonu,Yes,Sexual
3571,mukhe maal niye desher population komanor jnyo,Yes,Sexual
3572,Mukhe maal kheye kheye koto baccha tumi nosto korecho aj,Yes,Sexual
3573,Uffff. Khub e hot. E ekdom rosh e tosh tosh korche,Yes,Sexual
3574,Uffffff baby ei vabe tmr ghame veja sorir ta chai ami.. eto tai ador korte chai drlng,Yes,Sexual
3575,Uffffff sei din tomar sorir theke gam ber kore diyechilm,Yes,Sexual
3576,Koi r tipte di66o baby... Amar to khub i66a tmr gulo niye khela korar.. eto bollam akbr msg a elei na,Yes,Sexual
3577,Ami jantam tumi dekhte kala hoba,Yes,Appearance
3578,Uffffff amar nunu to gorom hyei ase tmr jnno tmi akbr eso tmr futo norom korbo baby,Yes,Sexual
3579,R nunu jodi boro hoi bou jodi nite na pare takhon,Yes,Sexual
3580,Ei khanki ta too 1 no er randi,Yes,Slang
3581,Ami sob samoi ai guluk chuse chuse khabo,Yes,Sexual
3582,Uff tumi ki sexy ummmmmmmma tomar dudute,Yes,Sexual
3583,Satti tomar ston gulo dekhte ki opurbo,Yes,Sexual
3584,Dhur bokachudi aage too friend request patha tobe too khir bar korbo,Yes,Slang
3585,Dudh er ki size go,Yes,Sexual
3586,"Sudhu ki dudh, tolate tight gud phete sobsomoy ha hoye thake, onek ke mukheo bara nite hoy, eisob bojha meyera nei",Yes,Sexual
3587,tmr ei duder bojha ami nebo...tumi aso,Yes,Sexual
3588,Tomar size koto ?,Yes,Sexual
3589,mota hoa gesopet ta komiya naw r o valo lagbe,Yes,Appearance
3590,Ufffs..vija sorir..chati dite iccha korche,Yes,Sexual
3591,Uff laora maigulo tipe gude jol ene debo,Yes,Sexual
3592,tui to nastik sheta amra sobai jani tui aro nastik er kase bikri hoye gesis,Yes,Religious
3593,togo shiva lengta hoia rishider stri der pise douraito,Yes,Religious
3594,malaunera bangladeshe eto ahe ke,Yes,Religious
3595,malaun hishebe noy ekjn manush hishebe bolsi desher shorkarer upor ektu chap dea uchit,Yes,Religious
3596,muslim ra hoilo osur amgo deb debire gala gal korse,Yes,Religious
3597,indiay malaunra kuttar loge biya kore,Yes,Religious
3598,are hindu ra to gorur mut khay,Yes,Religious
3599,ore vai maluner dol napaker goshti gail ditase,Yes,Religious
3600,hitlar ekta shottikare manush je ihudi shob sesh kore dite chaisilo,Yes,Religious
3601,emn vdo kono musolman korbo na korle malaun ra e korbo,Yes,Religious
3602,baler gan shunle matha kharap hoia jay,Yes,Slang
3603,ami chai india dhongsho hoye jak,Yes,Racial
3604,shami kala boila puray marse kala maush gula to tension e poira gese,Yes,Appearance
3605,khanki gula takar laigga choda loy,Yes,Slang
3606,tora malaun ra beshi mittha bolish,Yes,Religious
3607,dur kuttarbacca nastik er ghore nastik,Yes,Religious
3608,togo moto nastik er laigga musolman der ajk eto bodnam,Yes,Religious
3609,muhmmad jokhon baccha aysha ke bisanay nia jay oita dhorshon,Yes,Religious
3610,"iftar maghfil nishedh, puja sponsor kora hok",Yes,Religious
3611,tur taimeline e kisui nai tui sala malaun,Yes,Religious
3612,tor maiyare nia ami khelum ei piche ay shala malaun,Yes,Religious
3613,shib durga ke chudleo oy silo hijra,Yes,Religious
3614,tora to shiv er nunu puja koros,Yes,Religious
3615,jei hindu ra murti puja kore ora nijer dhormo mane na,Yes,Religious
3616,ei na hole malaun kuttar jat,Yes,Religious
3617,vai mukhta na dehaile vala hoito,Yes,Appearance
3618,apne quran dekhsen thikmoto? sekane nari dhorshon boidho,Yes,Religious
3619,dekhei to pagol sagol lage,Yes,Appearance
3620,noakhalir magi tora,Yes,Racial
3621,"khankir pola hinduder dorod nai, togo ase tora dhormer ki bujos",Yes,Religious
3622,din din atar bosta hoya jaitase,Yes,Appearance
3623,islam e narir morjada dise tai nabi muhamma dashi sex ar 15/20 ta biya korse,Yes,Religious
3624,manush maira islam rokkha hobe emn dhormor allahr hote pare na,Yes,Religious
3625,islam dhormo ta onek joghonnotomo dhormo shob desher manush toder ghenna kore,Yes,Religious
3626,ei meyeta dekhte etto nongra vabteo pari ni,Yes,Appearance
3627,tora onno dormer deb debi niya moja koros hindu gail des shalar alem namer jalem dia desh voira gse,Yes,Religious
3628,ei madarchud je lok ke dehaili she muslim na she ihudi she dari rekhe eshb natok korse,Yes,Religious
3629,jekono vbe malun amdani kore,Yes,Religious
3630,ekbar ma durgar gude prochondo chulkoni shuru holo sei somoy besshaloy e kono pola clo na,Yes,Religious
3631,eta mey na ihudir bachcha,Yes,Religious
3632,tor vuda to kto polay chuslo,Yes,Sexual
3633,kaba sharif niye je malauner baccha bengo korlo sorkar to or bichar korlo na,Yes,Religious
3634,ekta jinis bujlam na ekta haji chor gunda sontrash chadabaj dhorshok hoy kemne,Yes,Religious
3635,tui shib er nunu chusha public tui ki mone krli tate islam er kisu asejay na,Yes,Religious
3636,malaun ke juta peta kora hok,Yes,Religious
3637,mitta bole todr dormo e choto hoba tra mone pap niya dormo palon koris,Yes,Religious
3638,malun ra pakstani der baba bole dake kno keu bolte parben?,Yes,Religious
3639,gonesh namer je hati da ase oy shiv er pola na?,Yes,Religious
3640,ei mey porda kore na or ma kisu shikhay nai,Yes,Appearance
3641,shala maluner baccha torko na kore toilet bana,Yes,Religious
3642,khankir pola tui ekta shuworer bachcha,Yes,Slang
3643,khankir chehara ta dekhso mone hoy rape kora hoise,Yes,Appearance
3644,durga mar gude jkhn kamor uthto tkhn bessaloy giye kamor metato,Yes,Religious
3645,malaunra nognota sara ki bujhe?,Yes,Religious
3646,madachod arekjner gan niye moja chodao,Yes,Slang
3647,muslim theke hindu hole take hotta kora hobe eta islame ase,Yes,Religious
3648,mukhe ata moyda maikha bosti hoia gese ekdm,Yes,Appearance
3649,are vai shiva jdi debota der deb hoy she to gajakhor o charecterless ,Yes,Religious
3650,hindu gulor eto jole keno????,Yes,Religious
3651,tr profile pic dekhei buja jay tui kukurer ghore jonemsis sala malauner bachcha malaun hindu bejonma,Yes,Religious
3652,Apu tmr mukhe barishaillah vasa onk vlo lagse,No,Not Hate
3653,borishaillara chapabaj thikase,Yes,Racial
3654,barshiallara sesrar jat,Yes,Racial
3655,shala barishailla dendi khor launch er putki dhoira dhakay aisos,Yes,Racial
3656,dekh Vai barishal er chutiya public dekh,Yes,Racial
3657,borishal er manush der bisshash koris na vai,Yes,Racial
3658,borishal theke uitha ashe shala nongrachoda,Yes,Racial
3659,eder boy frnd gula kemon vabte c.. jei na chehara nam tar peyara,Yes,Appearance
3660,jara borishaler monu biye korechen tader jonno ek balti shomobedona,Yes,Appearance
3661,tmi Barishal er meye... Ewwww.,Yes,Racial
3662,b for barishailla b for bosti,Yes,Racial
3663,Tore biye dibo Borishaillar sathey ,No,Not Hate
3664,Shunlam borishaila chele ra bole hot hoy,No,Not Hate
3665,Maiya guli joss bt problem hoilo Borishailla,Yes,Racial
3666,ai hoile obostha borishailla der,Yes,Racial
3667,dekh koto shundar borishal er meye,No,Not Hate
3668,Isssh Barishilla ra emn kn.,Yes,Racial
3669,Hijra ki kore eikhane,Yes,Appearance
3670,Hijra naki pisoner gulo?,Yes,Appearance
3671,joto boro hoche tomr toto pore jache amr!,Yes,Sexual
3672,Oita ki chele na meye??,Yes,Appearance
3673,hijratar rate koto???,Yes,Appearance
3674,Sob khule tmr pix gulo dekhum r hat marum apu!,Yes,Sexual
3675,"Maigga,hijra go loge eto ki... Khacchor go motoo",Yes,Appearance
3676,Dindin hijra hya jaitaso,Yes,Appearance
3677,Tumi acho jotodin kheye jabo totodin,Yes,Sexual
3678,Pase ki eita pola na payjama,Yes,Appearance
3679,Aye tmi dui din por por esob elien kothay paw ami bujhi na,Yes,Appearance
3680,Accha ashe pashe ki egulai ghure?,Yes,Appearance
3681,Ei alien chagol gula re koitte pau,Yes,Appearance
3682,Dhur magichoda magi,Yes,Slang
3683,pola niye ghura bad diya hijra niye ghuro keno ?,Yes,Appearance
3684,Bichi nai deikha er shathe ghurtese naile atto din e onek khahini hoya jaito,Yes,Sexual
3685,Gay chuda tumake chude dibe,Yes,Sexual
3686,or kih kono saririk somosha ase ...nski????,Yes,Appearance
3687,Halar manush laganor jonno ekhon maiya saija thake iss,Yes,Appearance
3688,Apnare dekhlei apnare oidin j chuida disilo oitar kotha mone pore uff,Yes,Sexual
3689,Hijra niye ghuro kn..deshe ki polar ovab porche ha?,Yes,Appearance
3690,Oi hijra ta k apu?,Yes,Appearance
3691,Bichi wala apa,Yes,Appearance
3692,Ai mangerput ki emnei thake always,Yes,Appearance
3693,2mar dudher buni gulu chushe chushe mukher cheb shesh koira ditam,Yes,Sexual
3694,Eida to 2mare moja dite parbona. Amare neo. Emon choda chudmu 2mare voda dia amar dhon voira putki dia bair koira khech koira maal mukhe dalmu r naak dia bair hoibo. Uff 2mare pails,Yes,Sexual
3695,Boodar modde koita dhon dukaiso height,Yes,Sexual
3696,Sob hindu ra eyi dudh er opor fida,Yes,Sexual
3697,Grand kanion er depth= navir nicher depth... R mapte hbe na bara tmdr booda,Yes,Sexual
3698,mallu ra jate uthe na darate pare shei bebostha koro,Yes,Religious
3699,Kono mane nai amon roga cheler pakhi chotto. Motto,Yes,Appearance
3700,ami tipa debo tmr ta deba nki????,Yes,Sexual
3701,Loker ghore uki mara sobhab ta r gelo na,No,Not Hate
3702,Kadis na vai ekhono boro hobar chance a6e,No,Not Hate
3703,Kau jodi thakto chuse boro kore dito ,Yes,Sexual
3704,Dildo hisebe use kora jabe na?,Yes,Sexual
3705,Komar upor motherchod bold koira lekha,Yes,Slang
3706,"Pa Mele Shuye Thakun, Ja korte chay korte din",Yes,Sexual
3707,Jersy ba panjabi gift korte paren apu Jodi dite na paren tahole sex,Yes,Sexual
3708,Amar kaj kam nai tai ami shudhu bal falai moment,Yes,Slang
3709,Parents der taka toh pasa diye pore,Yes,Slang
3710,"Paa dhoira dibo chusha, maal faitta ber hoye porbe
",Yes,Sexual
3711,Amar kach theke amr puran sandals 1k te kinte chaisilo,No,Not Hate
3712,sell korlen na keno lol,No,Not Hate
3713,Tumar pasher room ta jodi amar hoto,No,Not Hate
3714,Doodh dekh ke toh pura khada he ho gaya lolipop,Yes,Sexual
3715,"Tomar bhodai 100 bAra
",Yes,Sexual
3716,Koto taka dita hoba ...ak radar,No,Not Hate
3717,"Aha ki dudu, valo kore tepo ogulo",Yes,Sexual
3718,Last er kotha gula shuna jai na ken nana mukh e ki jor nai?,Yes,Others
3719,Dhur hala sesra mor giya,Yes,Slang
3720,ore bainsud,Yes,Slang
3721,Miss korar moton ache ta ki ken miss korum,No,Not Hate
3722,Buddhir sathe chokhtao gese?,Yes,Appearance
3723,Ki hote dibinaa re?! Bou paliye geche??,Yes,Others
3724,Bhosedike jama tato katiye ne aktu,Yes,Appearance
3725,Daath ta meje ayyy,Yes,Appearance
3726,Tor Kusto Rog Hoise Kii Bhai,Yes,Appearance
3727,oyeee chapri bihari koitte aiseee,Yes,Racial
3728,Bokachoda tor jnno sandy saha e valo Bara tor theke to meyeta r weight besi,Yes,Appearance
3729,dada hagte parchen na ?,Yes,Others
3730,ore vaste gaja tore khay naki,Yes,Others
3731,Hattt madarchod . Ben k lode. Bhosdike,Yes,Slang
3732,kaku apna ka fu dila urajabaen . jokhon jhor hoba tokhon barier modhayie thakun baira ber hota hoba nah urajaben,Yes,Appearance
3733,Goriber bruce lee,Yes,Appearance
3734,Parler thake makeup koira forsa hoia ascha hero vai,Yes,Appearance
3735,Koto rongo dekhbo!,No,Not Hate
3736,Maiya re tip maira disot,Yes,Sexual
3737,Kalli kusssi hero alom,Yes,Appearance
3738,tui ar tor jamai,No,Not Hate
3739,Erum koira dakish na dada love moira jab,No,Not Hate
3740,e cheri dekh tor jamai ki kore,Yes,Others
3741,Bro ei gaanta bojhar moton khomota bangali der nai,No,Not Hate
3742,Ai ganta bangla des er protom dhake  mone hoy ni,No,Not Hate
3743,Tomadr eishobe vlo kichu hbe nah.Banglar tradition ke kharap korar kono right nai tomade,No,Not Hate
3744,Tomra Allah pothe asho...nahoy boro bipode porba,No,Not Hate
3745,ekhhn bujtso na ksudin por bujba mair kake bole,No,Not Hate
3746,Akta channel  ar sob gaan amn ajeb kmne hoi?,No,Not Hate
3747,ALLAH koi?eder ki dekhe na,No,Not Hate
3748,Eto shundor keno tumi takate parchi nah ,No,Not Hate
3749,tomar dudu gulo khayte icce korce,Yes,Sexual
3750,tomar bogole to chul ace apu,Yes,Appearance
3751,"Na dada , tiple esob jinis bare na",Yes,Sexual
3752,"tahole ami tipe dim ne, dikho dada boro hoibo",Yes,Sexual
3753,Taito torta jhoira porse,No,Not Hate
3754,2 pahare jokhn aksathe bari khay,Yes,Sexual
3755,TikTok nh thakle bujtam nh je bd te atto abal cho...a ache,Yes,Slang
3756,ganta sone onek haslam,No,Not Hate
3757,Kothar majhe jokhn Lal pipra jayga moto Kamor dey tokhn ai obOstha,No,Not Hate
3758,Sob gaja khor ei obaber dine ogore gaja dilo ke,Yes,Others
3759,Bokachoda der nobel deoa dorkar,Yes,Slang
3760,Khankir pola pagol hoigace,Yes,Slang
3761,Dudh gula cosar moto yuummy,Yes,Sexual
3762,Era kon highbrit use kore janta cawaa abar oboj mon..ato boro kamna,No,Not Hate
3763,Bhai faltu marka news kora off kore gali dilam na je news ta korche ,Yes,Others
3764,Norar jonno nise ,No,Not Hate
3765,Hoy ki r news er title ki dey.. shala matha mota article writer..,No,Not Hate
3766,Ami jashim uddin theke cng metre e bracu giyechilam 500tk ,No,Not Hate
3767,ajob koyekta buddhi protibondhi ase group e. ,Yes,Others
3768,Deikha chatai koira diyo,No,Not Hate
3769,Magi der sheet lagena.,Yes,Slang
3770,Sob test series e squad e tahke kinto kono somoy nei na,No,Not Hate
3771,hero alam ponde lagaw molom,Yes,Slang
3772,besi dami kinbn na .r oi dike iphone kohono original hoi na. r chok chok ala phone bhuleyo nibn na.1 la khono jaben na .taile prb hoibo na,No,Not Hate
3773,Copy phone sobgula,No,Not Hate
3774,ata gulistan kon jaiga?,No,Not Hate
3775,Akhan thaka Nia bar hota parban na,No,Not Hate
3776,Bai orginal charger koto,No,Not Hate
3777,hijratar rate koto??,Yes,Appearance
3778,joto boro hoche tomr toto pore jache amr,Yes,Sexual
3779,"Maigga,hijra go loge eto ki... Khacchor go moto",Yes,Slang
3780,Hijra naki pisoner gulo,Yes,Racial
3781,Kono cal girl aso...thakle knock daw.....valo price debo,Yes,Others
3782,Shb pic a ai baler hijra,Yes,Slang
3783,Sob khule tmr pix gulo dekhum r hat marum apu,Yes,Sexual
3784,Oita ki chele na meye?,Yes,Appearance
3785,Chilllll bro,No,Not Hate
3786,Hijra sagoler baccha 3 tare thabraite mon chay,Yes,Slang
3787,Bobbs gula kamor daoya dorkr,Yes,Sexual
3788,K k amr moto din e 5 bar falay,Yes,Sexual
3789,Dudh beshi barse,Yes,Sexual
3790,Sob khuila hat na mere thaka gelona r my step sis,Yes,Sexual
3791,or kih kono saririk somosha ase ...nski???,No,Not Hate
3792,salar beta dekhte hijra,Yes,Appearance
3793,Apnare dekhlei apnare oidin j chuida disilo oitar kotha mone pore,Yes,Others
3794,Pola na maiya!,Yes,Appearance
3795,Eta tmr ki lage ,No,Not Hate
3796,hijra magi,Yes,Slang
3797,Hijra,Yes,Slang
3798,Sathe ata meye naki,Yes,Appearance
3799,eita ke,No,Not Hate
3800,ata kon dhoroner prani?,No,Not Hate
3801,Hijra niye ghuro kn..deshe ki polar ovab porche?,Yes,Others
3802,Halar mukher mddhe doi falay dear dorkar ,Yes,Sexual
3803,Hizra,Yes,Appearance
3804,O re diya ki tumi tomare codao,Yes,Sexual
3805,Halar manush laganor jonno ekhon maiya saija thake,Yes,Appearance
3806,2jon e ladies,Yes,Appearance
3807,Bhoday ki tel lagaise naki,Yes,Sexual
3808,Tumi aco kothai..,No,Not Hate
3809,sob to mapa jacce,No,Not Hate
3810,nongrami last level,No,Not Hate
3811,"Bah, khub sundor lagche",No,Not Hate
3812,Vhoda dekbo,Yes,Sexual
3813,"Medha nai bole eivabe jibon jibika, opare kintu esob dekhaya par paoa jbe na bacha...",No,Not Hate
3814,Owo ki sundor. Ai vaaj dekhar jonno manusher koto opekkha khub sundor,Yes,Appearance
3815,Sry a bisoy ta secret share kora possible na,No,Not Hate
3816,Onek din por deklam,No,Not Hate
3817,Apnr kih mone hoi nah apnr gula din din boro hoitase,Yes,Sexual
3818,magir bacchar dudh dekhaite shorom kore na ,Yes,Sexual
3819,Tumar dudh gula tipte diba,Yes,Sexual
3820,looking beautiful,No,Not Hate
3821,Purai sexxy ,Yes,Sexual
3822,Apu brazzers apnake khujteche,Yes,Sexual
3823,tmr inbox ta check koro,No,Not Hate
3824,Ahaaa babe,No,Not Hate
3825,Pura khuila cobi ditay paro?,Yes,Sexual
3826,Apumoni boobs kotay tekay modified korsen ,Yes,Sexual
3827,Ibox a deowa jabe vai,No,Not Hate
3828,amne search korsili na?,No,Not Hate
3829,Sotti nam ta  ki go amio khuje paina ??,No,Not Hate
3830,Vaire vai Shazam use korlei to hoy,No,Not Hate
3831,moja payse moja payse,No,Not Hate
3832,Ei video gula dekhle depression kete jay,No,Not Hate
3833,Vai 3 nambar videor gantar nam ki,No,Not Hate
3834,Pran souch er din ses,No,Not Hate
3835,Ajo single aci,No,Not Hate
3836,Ahh sona go Amar khub kosto peye so go bolo,No,Not Hate
3837,Especial vedio dekhte chayle inbox,No,Not Hate
3838, jitte na parle O Eta dekhe valo lagche,No,Not Hate
3839,Last ball a jei kajta korse oita thik hoinai,No,Not Hate
3840,Pakistan madarchod,Yes,Racial
3841,Uni amader college e boshe ache,No,Not Hate
3842,koste vora jibon,No,Not Hate
3843,Acting na kore.. original try koren .. bro,No,Not Hate
3844,Ora obhinoi ke bhalobasha name dei,No,Not Hate
3845,Vai amader mohain college ene dekhtesi,No,Not Hate
3846,Tui valo hobe na sela ,Yes,Others
3847,Vai abul basar ke niye akta koren plz plz plz,No,Not Hate
3848,Bhai ra bhai hero alom ar o fan asy,No,Not Hate
3849,Ananta jolil er chai,No,Not Hate
3850,vaia apnr nmbr ta diyen plzz plzz plzz plzz plzz plzz,No,Not Hate
3851,full dekh moja pabi ,No,Not Hate
3852,O borda arar mohsin clg ot jaiyene prank call ,No,Not Hate
3853,Tumi amake fele or vedio dekho ,No,Not Hate
3854,ore magi tor kholer dosh,Yes,Slang
3855,"buker jomano betha, hero alam er kalo pasa",Yes,Appearance
3856,Ekhon ki tui kanna korbi?,No,Not Hate
3857,Shosta publicity,No,Not Hate
3858,Makeup girl Ra ki gorib naki gram theke uthe asha meyeder dress up kharap ?  ,No,Not Hate
3859,Manush re choto toh apni e kortesen ,No,Not Hate
3860,"Amar sir ekta kotha bole..""Chodai muri khaw jaw""",Yes,Slang
3861,Mohila bolate problem ta kothay??Hudai lafano baad diye have some pani ,No,Not Hate
3862,Khaled Kay daksi bhai Alia bhatt re cinse na tai re kila cinbo..,No,Not Hate
3863,ekebare hacca kota koichen vai ,No,Not Hate
3864,vai ekn apnar pise porbo ei maia,No,Not Hate
3865,ji api bujhlam but taal ke til banailen ken,No,Not Hate
3866,arr football khela miss universe diye hoy nah. sharadin make up pore boshe thaka arr mathar ghaam paye fele desh er shunam barano arek jish. chenel i e toh dekhlam ki answer hobe oitao script leikha dey kintu tara bolte pare nah,No,Not Hate
3867,judi 30 min football khelen taile apner mathay taak porbe 100% sure.,No,Not Hate
3868,Apu fataia desen akdom,No,Not Hate
3869,Ei maya k kosom allahr ei first name sonce and ei maya k dakce ,No,Not Hate
3870,Ami to aj dekhlam ke aida kothakar model Kao janle janan plz?,No,Not Hate
3871,Ami Miss universe Bangladesh.........Ka Aj cinlam..,No,Not Hate
3872,Ei make up artist der karonei tmi miss bangladesh hoiso...apu...  noyto ei cheharay miss alaka o hoita na,Yes,Appearance
