SL. ,Comment,Hate,Type
2404,anner dress koi afa,Yes,Appearance
2405,Khub sundor lagse,No,Not Hate
2406,tomake khub valobasi ami apu,No,Not Hate
2407,Tomar side theke dukkho bhalobashar mansuh chere gelo na dure chole gelo ,No,Not Hate
2408,Pitibite pran vore Mon Kule dukko kosto jontrona akmatro ma k bola jai..na bollew se Muk dake buje jai..mayer moto apn r kew pitibite hyna..ma jar nai dunya ondhokar ma Kotha bole ses hbena so I really love you ma..,No,Not Hate
2409,Apurbo tumr smile and pi,No,Not Hate
2410,Apnar ami onek boro friends apnar sate messenger a kotha bolar khub issa amr r amr basa bogura,No,Not Hate
2411,Amio onak Miss kori didi apnake ta shara daona didi plzzz,No,Not Hate
2412,Pic ta kub sundor hoysa,No,Not Hate
2413,Ay ses boyose o school a jawa lge...,No,Not Hate
2414,"Tumi kno ato sundor bolte paro??tomk onk base vlobase sotte sotte sotte,,I love your everything,,,",No,Not Hate
2415,Apnar chele k valo manush howar sikkha diben and Mother is the Headmistress.,No,Not Hate
2416,Biroktikor akta ovinetri osojjo lage dekte,Yes,Others
2417,Allah sobar maa k Valo rakhuk sustho rakhuk poro kale o,No,Not Hate
2418,Nice lagce apu and joy. k,No,Not Hate
2419,Apu anti bobly antir ceye apnar hasty ta 100gone Best,No,Not Hate
2420,Balobhasha Oviram dear sister.,No,Not Hate
2421,Amra sobai Apnar mar junno doya kori .....,No,Not Hate
2422,Football choto korar jonno.....Apu biswas gelen jim a ,No,Not Hate
2423,ami onek sesta korteci,No,Not Hate
2424,Apnar ma er jonno doya roilo,No,Not Hate
2425,jotoy gym koro..buri theke to r young hoba. na..tai na,No,Not Hate
2426,beshi dong no goirgo . Deikko na dana kata porir obsta ?,No,Not Hate
2427,khai khai atto mota hoico but jim korba na tato hby na,Yes,Appearance
2428,Amar to mone hoyna apni gym koren. Khali chobi tolar jonne pose martecen,No,Not Hate
2429,Eto Sweat hoye laav ki upnar weight toh kome na,Yes,Appearance
2430,Ekhon aramche esob koro pore bolba khelar por shikar korche nh bacca or,Yes,Others
2431,"depends, deodorant lagano thakley thik achey",No,Not Hate
2432,Tui gama amar ettto gamanor eccha nai. Khacchor maiya!,Yes,Slang
2433,notun kore abar crush khailam,No,Not Hate
2434,"amr mone ace,tokon ami onk picce cilam apna ke btv te dektam akn ami biyer juggo tik amni acen apni bah bah",No,Not Hate
2435,Tumake kub valo lagche,No,Not Hate
2436,kekhane thako monche ese dekha koro,No,Not Hate
2437, keno chikon hoya ki khubi dorkar,No,Not Hate
2438,chikon to hosso na,Yes,Appearance
2439,pori monir moto jeno na hoi,Yes,Others
2440,Amra jani upni thik ghure daraben. Ar amra aci upner pashe.,No,Not Hate
2441,Kamon acen sister,No,Not Hate
2442,Aro 20kg komano  dorkar apnr.,Yes,Appearance
2443,Tumake o akdin RAB ese kaj ta kore dibe ,Yes,Others
2444,Arektu fat hoya dorkar,Yes,Appearance
2445,55 kg te aste hobe..,No,Not Hate
2446,apu apni o list e achen ,No,Not Hate
2447,Paza din din boro hcce kn kotai disso mone hoi,Yes,Appearance
2448,Kali mim soytannir ita nokol korio na,No,Not Hate
2449,Apu ki WWE khelba naki ,No,Not Hate
2450,Oi apu...... joy ki kora....,No,Not Hate
2451,baalmarka cinema koran kn,Yes,Others
2452,biral tight hoy na gim korle,Yes,Sexual
2453,Bishe kore koro,No,Not Hate
2454,Ma cele 2jone sob somoy win hoa a kamonai kori.,No,Not Hate
2455,Bangladesh jindabad,No,Not Hate
2456,Aso apu khatal khai..,No,Not Hate
2457,igu ratke nah up dile kitha oile one..,No,Not Hate
2458,Apu joss but tumar satti kotha bolar anek icca celo apu,No,Not Hate
2459,Tomar sathe kotha ache go.,No,Not Hate
2460,Ami je tomake valo basi tomi ki seta jano,No,Not Hate
2461,Ma cele 2jon ke khob cute lage,No,Not Hate
2462,"Otho sundor hoico ni ekon,aiyou amra abar biya korilai ",No,Not Hate
2463,Nice apu kub valo lagche,No,Not Hate
2464,Bd ar jarcy ta k osomman korlo re,No,Not Hate
2465,Apu apni to Porimonir moto gorom na,Yes,Appearance
2466,Aso khalbo khala hoba ,No,Not Hate
2467,congratulation Bangladesh amar desh amar ahngkar,No,Not Hate
2468,apu ami apnar pic lab di,No,Not Hate
2469,Sabdan pore moni dora khayce kintok bese natok koy ro na,No,Not Hate
2470,Apu tumar motoi tumar sele mota,Yes,Appearance
2471,ek somoy tumar movie dekhte khub valo lagto akhn tore dekhlei rag uthe ,No,Not Hate
2472,Ai pic dekhe  ar ki bolbo apu didike amar kotota valo lage ta boleu  bojhate parbona,No,Not Hate
2473,big theke small hoye gelo kivabe apu,Yes,Others
2474,Apu ami apnar sate deka korte chai sotti apu,No,Not Hate
2475,"apu raat asben, apnake amr vaccine dibo ",Yes,Sexual
2476,Oi misti pori k ato ato love kori,No,Not Hate
2477,Chain er vitore e ki ache kao bolben,No,Not Hate
2478,"Ei boro boro,,abar dekhai jai na,,uff bujlam na",Yes,Sexual
2479,Apni atu chikon hoilen kivabe?,No,Not Hate
2480,Tomak veeya korbo,No,Not Hate
2481,Apni Islam grohon korun allha apnki khoma kore dibe,No,Not Hate
2482,"6-10 porjonto crush tomi amr,,akhon onk jon hoyse",No,Not Hate
2483,Kibabe komaila bodi da..  Sai figar oice,Yes,Appearance
2484,Darun change asche,No,Not Hate
2485,Apu tumi Bangladesher Queen,No,Not Hate
2486,Ata amar id..sobai riqost pathaw..100% bk to bk...inaha allah...,No,Not Hate
2487,tmi ki khaw go,No,Not Hate
2488,dasha theke sukna kno jinis ,No,Not Hate
2489,Tumr mukh ta e kemon beka bara,Yes,Appearance
2490,"Shuvokamona Sob Somoy 
Bon Aponar jonno...........",No,Not Hate
2491,oi kharap sobi jaygay khali tmi ki koro ha,Yes,Others
2492,New New move ci Apu Biswas India Bangladesh comdy move ci,No,Not Hate
2493,iye gula choto lagca kno,Yes,Sexual
2494,ki mal re baba!,Yes,Appearance
2495,o appu so Nice,No,Not Hate
2496,"sare te nari, bt apni magi",Yes,Racial
2497,"sexi Good fegar, amr hoba tumi",Yes,Sexual
2498,Mara gela dakbi ki hoy,Yes,Religious
2499,"allah k voy kor, borka por",Yes,Religious
2500,"Eita green hoi kmny,  amgo apu vai toh deksi colour o chene nah...eita tiya colour ",No,Not Hate
2501,ek pic koto upload diba!,No,Not Hate
2502,"tmr dres ta pocondo hoy ni amr, khet kno emn",Yes,Appearance
2503,Aro shundhor jamai paita kintu arektu wt krle,Yes,Appearance
2504,nic lehenga ,No,Not Hate
2505,Amaaar sona tah!,No,Not Hate
2506,"deki kotodin tike, heh ",No,Not Hate
2507,ei cilo tomar mone,No,Not Hate
2508,Oporadhi hajaro chaler mon vanghe dicho tmi ,No,Not Hate
2509,boyosh koto hoisilo jani?,No,Not Hate
2510,Khelte peebe na thik thak vabe,Yes,Sexual
2511,onek sudor lagse eksathe duijon k,No,Not Hate
2512,Tomar sathe vab hoilo naa arr,No,Not Hate
2513,Tmr biyer pic ato joghonno hobe vabte o pari nai,Yes,Appearance
2514,Tui post dis na..polapain sob gular khub kharap lagche.bishes kore amr choto bhay er....,No,Not Hate
2515,DuDu boro hoye gese di apner unar hand er chapatipa poira,Yes,Sexual
2516,Oporupa sundori,No,Not Hate
2517,Pic ke megngar a anacan ,No,Not Hate
2518,Cheka kaila miya!,No,Not Hate
2519,ses porjonto ki toi tare niya sopno dekli,No,Not Hate
2520,mon venge dile amar ,No,Not Hate
2521,biyete dawat dibe bolse. Tkhn gift niya biya khaite jamu. Amr obosso somoy kom,No,Not Hate
2522,"jei thanda ekhon, eto choto kapor kno. dekha jay to ",Yes,Sexual
2523,valobasi tr roddurmaka hasi,No,Not Hate
2524,trpr bolun.ki gift dilen takee,No,Not Hate
2525,"lamba cowra, body Fitness sob dik diye thik ace beda ",No,Not Hate
2526,Amr ak vabi ase uni amk bole ami nki tmr moto dekhte,No,Not Hate
2527,mone hoi vai naite to akib vai a naite amne bolto na,No,Not Hate
2528,"murgi khay dhan,tumi amr jaan",No,Not Hate
2529,Ami kisu dekhi naai,No,Not Hate
2530,zum korle deka gay,Yes,Sexual
2531,Smile dekhle matha ghuray,No,Not Hate
2532,"ekdom koci bou, gitsen vi",No,Not Hate
2533,Deikha mone hoitase cina cina lage koi jani drkchilam,No,Not Hate
2534,Ole dim apu.... Din din chokh gula gorter modde chole jacche kn,Yes,Appearance
2535,Tumi ato sukna kno?,Yes,Appearance
2536,amar ta toh er theko besi perfect,No,Not Hate
2537,Sundar lagcha.,No,Not Hate
2538,Vlo hoye jan,No,Not Hate
2539,Tmr postir ovab,Yes,Appearance
2540,Tmk dekhte khub sundor lagce...Tmi sob somoi sundor,No,Not Hate
2541,shate sleeveless blaous hole aro valo hoy,Yes,Others
2542,Dolna ta order dese go..,No,Not Hate
2543,"eto saxy keno apni, pagol hoi jai deke",Yes,Appearance
2544,gali dileo galir osonman kora hobe tai dilam na.,Yes,Others
2545,"navir nice pant, ci",Yes,Appearance
2546,Ato shundor kno tumi.r khaowa dawa ki korona naki esssssre amr sonata ki shukiye gese,No,Not Hate
2547,hukka hukki chole taile manueelll,Yes,Others
2548,iamito apnare follow dia rakhsi apnio dekhi abar arek jaygay ukkan ,No,Not Hate
2549,niser chamray tan lagle sob ses tnr moto,No,Not Hate
2550,or sathe tip tip panir dance korte cawa amr mon,Yes,Sexual
2551,Din din Crush ar ruchi  change hoitece,No,Not Hate
2552,Apnr crush er ovosta ata kobi,No,Not Hate
2553, hae tmr fan follower je buja e jay,No,Not Hate
2554,"drs eejonno cmnt kora kome jacche, coto coto ekhon kali",Yes,Appearance
2555,dst Tumi Kiso gift kore daw,No,Not Hate
2556,valo hoye jao msud tmk ami onk sujog disi r na vlo hoye jao,No,Not Hate
2557,tor chareector er i plbm ase masud na hole ki onno j kono unknown miye dekhlei tor comment korte icche kore....r jodi tor charector e plbm i na thakto tahole sera kapor er dike cokh kn jabe,Yes,Appearance
2558,Amr bondhu Mithu social side a active thakle akhon akta hole o comment kore jeto,No,Not Hate
2559,Tura  ki konodin bora hobe,No,Not Hate
2560,Kiso komu na ,No,Not Hate
2561,cira pant porcs,Yes,Appearance
2562,"butam tura beimani koris na, sobai dekbe to",Yes,Sexual
2563,Pori moni r  best bandupe,No,Not Hate
2564,Amre bollei to amr jama tA diye ditam jodio onk kosto hoto,Yes,Appearance
2565,baaah Khub Shundor saav,No,Not Hate
2566,Amar dhukkho laiga gelo,No,Not Hate
2567,Chuma Dile khub bhalo lagto,Yes,Sexual
2568,porimonire niye j manush troll kore..hudai,No,Not Hate
2569,Omg baccha hoiya gelen kobe,No,Not Hate
2570,"buira bedi, bacca go jama pore, sorom nai",Yes,Appearance
2571,Tmr o oita fatar somoy aisa porse baby,Yes,Sexual
2572,Behaia pona kokhono adhunikota hote parena,Yes,Others
2573,Eta abr kmn style er pant,No,Not Hate
2574,Tumer ki giyer thela dica nay ai thanday,Yes,Sexual
2575,Din Din sundor hocchen,No,Not Hate
2576,Ai dress tuku na porleii ki hoito bisrii akta,Yes,Appearance
2577,goriber sani Leone apni ,Yes,Sexual
2578,"apni o goriber pran, tai apner moto bondhu peye ami dhonno. amar jaan bondhu L.  goriber jonno onek upokar kore.",No,Not Hate
2579,bhaiya apo to sundor o jon mon hoy tini natok kore on basi ,No,Not Hate
2580,Tader kotha kokhono vula jbe na,No,Not Hate
2581,"Purai Agun,bastbe dekha khub iccha",No,Not Hate
2582,salar luccami bad de valo ho,Yes,Others
2583,Ore pagol hoye jabo ami pagol hoye jabo ,No,Not Hate
2584,premer ee jore morci kape......,No,Not Hate
2585,Aunty k tw chinai jacce na,No,Not Hate
2586,apnar Skin tone Duplicate,Yes,Appearance
2587,Hadi gula ber hoye ase boin..moto how .,Yes,Appearance
2588,Tumi emon photo cherona go kemon hoy,No,Not Hate
2589,Mekap er maire bap,Yes,Slang
2590,Ai pic dheke mb ses Kai dai kam nai Sudu pic upload ,No,Not Hate
2591,"Ar ki chai, oij daab gula sudu",Yes,Sexual
2592,Oi shunoo.. Prem korba ,No,Not Hate
2593,Ring ta onk sundar ,No,Not Hate
2594,Chapa mero na iPhone diya tulso eta,No,Not Hate
2595,ufff tumar m*l eto balo kem ne,Yes,Sexual
2596,Mim namer meye amr shotru,No,Not Hate
2597,amr paki tomay dekle lafay,Yes,Sexual
2598,Totto je doll pelei hei dim,No,Not Hate
2599,Ato sajer modde ekta patni kaw sundor lagbe,Yes,Appearance
2600,kha kub lakthe ho,No,Not Hate
2601,Dear crush Tmk dekhei amr guitar e 1st shur uthechilo Tmk dekhlei amr oita daray jay. Gayer lom,Yes,Sexual
2602,"Vivo V21 
Aita lekhar jonno koto tk peyechen",No,Not Hate
2603,Aww kubb xundr,No,Not Hate
2604,"kobe korln ei kam,,bou rekhe singler moto vab lon kere vai?",Yes,Others
2605,Taratari biye Kore niyenna abr .,No,Not Hate
2606,"apni single thkle propose krn,vlo manabe",No,Not Hate
2607,Inbox e hi bolleo parte,No,Not Hate
2608,"inbox e shudhu hi bolbe kno tomake.. hi to normal fan der jonno.. tumi to fan na, family ",No,Not Hate
2609,Tomar nat bou ,No,Not Hate
2610,dekhte hobe na Kar neighbor,No,Not Hate
2611,"abr ki howar baki ase, mica bolen kn",No,Not Hate
2612,jekhanei jai shekhanei apni!,No,Not Hate
2613,Tui e to gift korli or birthday te,No,Not Hate
2614,Ai tui nijer dike kkhono taico,No,Not Hate
2615,tomago moto gajakhor code na,Yes,Slang
2616,oi boro jora  golo ki,Yes,Sexual
2617,amar ei page tate sobai like daw follow koro plzzz,No,Not Hate
2618,koto choto?Feeding khawar boyos theke naki..!!!,No,Not Hate
2619,sby tmr crush naki hae!!,No,Not Hate
2620,Jara bole amra shonkha logo tader ai desh ai thaka dorker nai… ai desh shodo Bangali jatir. Jara dhormer name ai shob kharap kaj kore Tara r jai hok kono dhormer hote pare na… ai desh kono dhormer noi… ai desh amader sober. ,Yes,Racial
2621,"Aro besi kre goru,sagol, vera murgi korbni dao",No,Not Hate
2622,Dhonnobad potibad ta korar jonno,No,Not Hate
2623,"Kar kache dabi korche, amra o paser deshes (apnar nana barite) amra sonkha loghu.",No,Not Hate
2624,Bosta Pocha Doilouge Mere Sympathy Na Niye Kono Step Keno Neoa Ho66e BD Government theke,No,Not Hate
2625,Je somoy kashmir a hamla chalaise hindo ra tokhon kothai chilen... ek pokhho nile hobe nah,No,Not Hate
2626,Jara pujor pandal puriyachay Maa er bigroho tay haat diyachay r manush khun koraychay Iswar ekdin tader thik e paap er sasti deben,No,Not Hate
2627,Khubi  shundor akta kotha bolchen apni.,No,Not Hate
2628,Lekha ta balo lagelce,No,Not Hate
2629,Kuran k opoman korse eta nia karo mathabatha nai r hinduder gorbari poraia dise eta akhn sobr culkani uitta gsa,Yes,Religious
2630,Adalat dekhben....kivabe lathi thik Theke r sap o more...,No,Not Hate
2631,Ho kuttay kamraise tho . Atho tk diya puja koira nijera puraibo. Egula tumr moto manusher kam. Jara support diteso ,Yes,Others
2632,Valo bolecho priye,No,Not Hate
2633,Didi deri hoye gelo na,No,Not Hate
2634,Ata bolta ato somoy laglo??,No,Not Hate
2635,kahini ostomir din theke suru hoiche ar ei mohila aj protibad korlo,No,Not Hate
2636,chirotore ghumay jayto,Yes,Others
2637,mim er age koi cila acon kbr hosse kno,No,Not Hate
2638,Deshe sikkhar ovab ache apu  ,No,Not Hate
2639,J bakti. Nij  dormoke. Valobashe. Sai. Bakti. Onner. Dormoke aghat. Kore  na,No,Not Hate
2640,apni 1bar Valo kore Quran ta poren puro puri  . Apnar AI dharona bodle jabe.  Sobaike nijer diye bichar korben na.,No,Not Hate
2641,Mon chuye gelo apnar kothagulo..,No,Not Hate
2642,India nia kichu bolen..??,No,Not Hate
2643,raastai namun aage protibad korun are apni toh bakrid palon koren eisob ye kichu jai ashbena apnar,No,Not Hate
2644,ei dike ere etwdin muslim vaba nispap ami,No,Not Hate
2645,Toder manusgulo ato kharap Kno?,Yes,Racial
2646,vai apnar kono khoti korse?,No,Not Hate
2647,Akta manus ato sundor hobe kn ta,No,Not Hate
2648,puja asle ganja khao na.,Yes,Religious
2649,Kotto shundor tmi,No,Not Hate
2650,Amar buira crush,No,Not Hate
2651,kn tui janos na gadhi oy j hindu,Yes,Others
2652,"Eid Look, pujo look 2 tai dekhlam..... Muslim naki hindo taw vablam.....  namer seshe mim dekhe Muslim manlam................",No,Not Hate
2653,ondo vokto amar vai,No,Not Hate
2654,Ajka valo kichue paiba....,No,Not Hate
2655,Laddu khawar dawat daaao,No,Not Hate
2656,tomr crush abar ganja o khay ,Yes,Others
2657,Tor poja tor sarir nij diya de salir baccha salira,Yes,Religious
2658,saritei apnk onk cute lge,No,Not Hate
2659,Tumi amake wish korla na,No,Not Hate
2660,Moslim hoyeo hindoder Utsab palon kore,Yes,Religious
2661,Mondiro jha giya matir murthir faw duka tor sunat tui ekta muslim oya pojor look sudas ,Yes,Religious
2662,"Aj morning ey tomer satha dakahoyasilo,Tomaka kub sweet lagsilo ",No,Not Hate
2663,Next pic pojar sare pora pic a dekte cai ,No,Not Hate
2664,Ore Crush Tmk j keno Ato Vlo lage Atai Bujhi nah,No,Not Hate
2665,Ami more gele bujhba. . J tmr ekta pemik chilo,No,Not Hate
2666,shokuner duwai konodin goru morini,No,Not Hate
2667,piliz moire jaa sala,Yes,Others
2668,Basat dawat dila na ei pujuy..purano hoye gechi ami na?,No,Not Hate
2669,valo hoye jao sunny,Yes,Sexual
2670, Mim apur kukur take valo lagche...Amay diye diba,No,Not Hate
2671,sob nayka der pic a ei pola ter comment thak ei Abul akta,Yes,Others
2672,Tomar doggy tar style shondor,Yes,Sexual
2673,Bagha te aso...Age tomar jonno tao puja dubano dekhte jaitam ar asona keno?,No,Not Hate
2674,Earring ta onek sundor ,No,Not Hate
2675,Darun lagche didi,No,Not Hate
2676,dekhe khub valo laglo,No,Not Hate
2677,Ami tumar dhormer  na tao tumake  onk valobasi,No,Not Hate
2678,Touba tomi hindo api,No,Not Hate
2679,Atu sondur manus life a pawya so difficult,No,Not Hate
2680,Khub sundor lagche,No,Not Hate
2681,"reality onk nisthur, ja bujji etodin",No,Not Hate
2682,eisob deikha biyar ja shaad asilo jaitese ga!,No,Not Hate
2683,"love you bollam na kintu, mon kharap koiro na",No,Not Hate
2684,toi ekta kuttar bacca,Yes,Slang
2685,assignment na.. Ami nijei..,No,Not Hate
2686,Likha to silo onnow kichu mone hoi,No,Not Hate
2687,Nunu kete fele dilen,Yes,Sexual
2688,Actual lekhata jani kintu bolbo na ,No,Not Hate
2689,Ferot pawar chances khub kom.. btw charger sell korle janaben.. ,No,Not Hate
2690,"vai paben apni thanai jidi koren,,,,  ami amar k20 pro 1 bossor pore peyesi,,, ora jodi phnta nosto na kore to pawa jabe insa allah",No,Not Hate
2691,Thanay gd koren.Then Aponar kono police relative thakly tar sathy jogajog koren.,No,Not Hate
2692,vai er course ta dekhte paren ami korci ... Onek valo sikhai ... Spni caile unar YouTube channel thekeo sikhte paren free te ,No,Not Hate
2693,Even apni chole jawa manei LORD Litton & Soumya again chance e thakbe -,No,Not Hate
2694,Oita Khele Retired newa uchit,No,Not Hate
2695,Fb potibondira sele take appreciate na koira,Yes,Others
2696,Public vetkaytese kn!!!ora jitay dekhayse...korse toh akbar ota e amdr best chilo...respect kora uchit,No,Not Hate
2697,Bal palaiben,Yes,Slang
2698,hoo.akhn jara khele tara bal felaiche r tmi giye ta adhi banba....,Yes,Slang
2699,Koidin porei sokh koimi jabo,No,Not Hate
2700,khelar agei fapor shuru hoise...,Yes,Others
2701,Baro bal felaba,Yes,Slang
2702,Humm bujte hbe aigula bogura r pola....dole dak pawer age sob jitta ses kre detaso,No,Not Hate
2703,pani r dhore rakhte parlam  na,No,Not Hate
2704,mane cokh diya pani beriye gelo,No,Not Hate
2705,Vai Legend  na hoewa sob bojta para amer mon,No,Not Hate
2706,Eita kar hote pare ekmatro nisho vai chara kee bolte parbe na,No,Not Hate
2707,dakh to kichu mil pao kina ,No,Not Hate
2708,sosur bari ar aktu samne,No,Not Hate
2709,anda kheye ekbar science exam disilam...91 paisilam...,No,Not Hate
2710,2 year exam er pera silo nah tokhon bolse scl kn khule nah r akhon scl khuila dise exam er perai ses,No,Not Hate
2711,lekhapora kare ki hobe akdin to morei jaben tar theke dim paicen oitai vlo ...baija khaite to parben,Yes,Others
2712,Sei moja kuira khaite parben,No,Not Hate
2713,Surprise agy diye dity hoy nah... bujy na ara,No,Not Hate
2714,tmader results!!!!!!! misti ta age khaway dile vlo hoy ..tmder proti amr 100% varosa hai yr j tmra atai pabe..tai to age vage misti kheye nite chacchi..wese bohot sweets khane ko milegi meri jaan...,No,Not Hate
2715,post ta deke khub haslam,No,Not Hate
2716,Ay hay kiii bole...kn apnr teacher kiii result er bodole dim diyecilo nakiii ,Yes,Others
2717,kisu komu na shorom kore,No,Not Hate
2718,Exam  er agei result dekhe fellam,No,Not Hate
2719,same obosta re dada....,No,Not Hate
2720,Amr result ar kothao mone portece akhn,No,Not Hate
2721,Allah map koruk,No,Not Hate
2722,Hoini tobe khub taratari hobe ,No,Not Hate
2723,Ai rakom anda ami jibone o dekhini amr exame mone hoy ato boro anda pabo na,No,Not Hate
2724,Jaita amk abr puruskar hesabe diya hoba ,No,Not Hate
2725,oo acca veje kheye nibo,No,Not Hate
2726,Amr porikkar katar dim r o boro hobe,No,Not Hate
2727,Ebar amar obostha o amon hobe ,No,Not Hate
2728,Todr basar sby etodin thakbe dhakai ?,No,Not Hate
2729,tor ki mone ache math e 0 pawar kotha,No,Not Hate
2730,janina ki jonno mone hoilo tmr aita dorkar,No,Not Hate
2731,ei vang garir mal ta keda?,Yes,Sexual
2732,etodin por hijlar upor?,Yes,Racial
2733,nodi shob shomoy nodi e thakbe,Yes,Slang
2734,toder moton bejonma shangbadik er kase porichito,Yes,Racial
2735,ccccc pori ata ki korla bby,No,Not Hate
2736,shokol shangbadik poriri pasar sathe mishe thake kokhon pad dibe,Yes,Sexual
2737,Pori moni akdin bura moni hobe tokhon hoito onushuchona hobe.,Yes,Others
2738,Behaya pona kore ki kore viral hoa jaye..jotto sob,Yes,Others
2739,sangbadikera porimonir pachay mukh dia thake kkhn porimoni pad dey.padar sathei news,Yes,Racial
2740,"Ktota nilojo behaya hle manus amon krte pare,akta parar meyer o lojja srom ase but ai sob primonider lojja sorom nei,chi dikar tuder mton narider ",Yes,Others
2741,heti magir dalal,Yes,Sexual
2742,Longi porche naki,No,Not Hate
2743,Pagol hoiea Jabo..,No,Not Hate
2744,apo ai rokom olta palta kaj korla valo thakr ki kono upay ace. Pagol hoiea Sara. ,Yes,Others
2745,Sunechi se naki khub sundor khela day,Yes,Sexual
2746,kothakar taroka naki potitar khodder,Yes,Sexual
2747,Wow buro bara debe,Yes,Sexual
2748,tor nana chumma khacche,Yes,Sexual
2749,upore lal niche shada khub chomotkar,No,Not Hate
2750,Mental mone hosse,Yes,Others
2751,aha re lal pori taa...,No,Not Hate
2752,Jemon nana temon tar nati,No,Not Hate
2753,Lucca Akta..meye namer kalonko..,Yes,Others
2754,Ai beyadop ta ke kokhono valo hobe na,Yes,Others
2755,taka ready koro kaj hoya jba ,No,Not Hate
2756,hetir nanar heda,Yes,Slang
2757,Morleo manus hoibo na,Yes,Others
2758,Latthy maira ber kore na kn ei baal ta re,Yes,Others
2759,Tobe ato zoom kore dakano uchit hoy ni!,Yes,Sexual
2760,Jaroz sontan ara,Yes,Others
2761,Nanay Malta kheye dilo naki ,Yes,Sexual
2762,Or vodai rang mako nai,Yes,Sexual
2763,Dod ber kore pic tula thik na apu,Yes,Sexual
2764,Lunngu kule dance,Yes,Sexual
2765,Dress ta amon kn? Kicoi thu bojlam na,Yes,Appearance
2766,Lotir bacca hujur er samne dud ber kore rakhche,Yes,Sexual
2767,cheri ekta pagol bal,Yes,Others
2768,Amrr invite card taa niye tmi gelei parta...ekta lungi dance dite hoye jaito,No,Not Hate
2769,A cemrir ki morar boy nai o ki akbaro beba dakhca ja or mora lagbo airokom kore ki lab akbar jel a nicha tate or sikkha hoini ,Yes,Others
2770,Asholei shob pagol sagol Bangladesh er e jute..,Yes,Racial
2771,Allah ore nunu deyar toufik daan korun ....shokole bolen Ameen,Yes,Sexual
2772,Manus taka r famous hole atota niche neme joghonno hote pare dekhleo lojja kore..porokaler voy nai.. Allah asob meyeder hedayat deouk.,Yes,Others
2773,Allah rohomot koro..,No,Not Hate
2774,Eto behaiya kmne,Yes,Others
2775,mal mathai outcilo mone hoi,Yes,Others
2776,Ai meyek gaja ke dise . Ze dise amake inbox koren,Yes,Others
2777,lengtar nai batparer bhoy,Yes,Sexual
2778,Kule pel na ta hole aro valo hobe kanki,Yes,Sexual
2779,Nirlojjo behaya kuttar baccha,Yes,Others
2780,Lungi da khuilla gele valo hoito ,Yes,Sexual
2781,Khob taratare. asob.  falto.   manos. golare.    pagla garot a. patano hok,Yes,Others
2782,Ore rehave eeee deoaa uchit ,Yes,Others
2783,Kon desh er prani re vai Eita..uff bujlam na,Yes,Others
2784,Ce ce magi akta,Yes,Slang
2785,Buror e to kopal.,Yes,Others
2786,Baler actress.,Yes,Racial
2787,Ami to just uporta dekhei fida hoycilam.Allah somoy  thakte bachaiche.bole na upore fitfat vitore sodorghat,Yes,Others
2788,A abar kmn dresser style re  baba bujina kisu,Yes,Appearance
2789,Natnir kase nana oshohay,Yes,Others
2790,Tor bow re chudsi. Ki sonar jonoprio. Khanir pola r kono news nai ,Yes,Sexual
2791,Hayre abul ak ak somoy ak ak kotha bolos bah akbar porda vallage ahon abar queen pori moni ki komu ar...,Yes,Others
2792,Prithitlbite maiyar avab porse????,No,Not Hate
2793,Oi mohila kon dik dia miss Universe howar joggo?????,Yes,Others
2794,O miss Universe hoite parle amio BCS cadre hoite parbo.,Yes,Others
2795, Mane eita kono kotha??? ,No,Not Hate
2796,Allah tomar kache onek sukriya j ai rakhoshir hat theke Shakib  k bachaicho.r o miss universe hobe r kichu ashteche na.,Yes,Others
2797,Ami ekta jinish bujhtesina Ekhane haha react keno ashtese,No,Not Hate
2798,Ami manlam meyeta hoyto age onno rokom chilo ba amader desher ekjon cricketer ex chilo,No,Not Hate
2799,But meyeta jehetu career er dike focus hocche achieve korche i hope take support deya uchit Ekhane kono kotha e haha react er chilo na,No,Not Hate
2800,Apnarao onek emon kaj koren  jeta kokhonoi kora uchit na ba chilo na  Shobar e worst past thake,No,Not Hate
2801,Haha reaction diye nijeke stupid prove korar reason ta bujhlam na,No,Not Hate
2802,"fact hoilo.. oi video korar bishoy ta eto manush janto na jdi na ow nijei oi ""choto azad"" er interview te eto roshay roshay bolto and eto roshay boltesilo j, j kono sustho manush er mone hobe ow ekta psycopath.I saw the( interview just after few months but amazed that no one took the liberty to post publicly against it. even sakib er sathe prem er bepartao keu janto na jdi na ow nijei eta manush k bole bole  media te advantage nwar try krto.",No,Not Hate
2803, amio oi jonnai asachi cmnts krte samei bapar,No,Not Hate
2804,Halai Amon  maiyawo jode miss world Bangladesh hoye Jay. Bangladesh reh kamne represent korba kharap  laga asola judges hesaba Jara thake Ara taka poisha khaiya Lai,Yes,Others
2805,miss Nigeria o kintu miss universe hoyesen vaia.  Shudhu chehara...onk kichu dekhei then dcd kora hoy,No,Not Hate
